"ID","Item title","Final URL","Image URL","Item description","Price"
"10409518170411","Digitalni LCD instant grejač vode 3500W — termostatski","https://www.kupilica.com/products/digitalni-lcd-instant-grejac-vode-3500w-termostatski","https://cdn.shopify.com/s/files/1/0843/5738/2443/files/digitalni-lcd-instant-grejac-vode-3500w-termostatski-1.png?v=1780472973","Instant grejač vode 3500W — topla voda za 3 sekunde, bez velikog bojlera ✅ 3500W snage — voda se zagreje za par sekundi, bez čekanja ✅ Digitalni LCD ekran — vidite tačnu temperaturu vode u realnom vremenu ✅ Termostatska regulacija — postavite željenu temperaturu, uređaj je održava ✅ Bez velikog bojl","4490.00 RSD"
"9049999769899","Digitalni sef sa 2 ključa","https://www.kupilica.com/products/digitalni-sef-sa-2-kljuca","https://cdn.shopify.com/s/files/1/0843/5738/2443/files/2_4035e088-b015-4487-8b1e-8616826a660a.png?v=1708504592","Kućni, kancelarijski ili hotelski sef, jednostavan za upotrebu, pouzdan i siguran. Pruža dodatnu sigurnost vašeg boravišnog prostora. Sef je moguće, sa unutrašnje strane, fiksirati, šrafovima, za podlogu. Sef je standardnih dimenzija dovoljnih za čuvanje vrednosti, jednostavan za upotrebu, pouzdan i","3500.00 RSD"
"9587089572139","Disk solarne led lampe 4 komada","https://www.kupilica.com/products/disk-solarne-led-lampe-4-komda","https://cdn.shopify.com/s/files/1/0843/5738/2443/files/main-image-3_1816fbb5-c9a5-45c3-ab84-1f72a40df681.jpg?v=1721213263","Osvežite svoje omiljeno mesto Solarne disk led lampe koje će promeniti u potpunosti energiju i izgled vašeg omiljenog kutka Bilo gde Solarne disk led lampe možete postaviti gde god želite. Bez postolja na beton staze ili ogradu, sa postoljem koje se jednostavno postalja možete zabosti u zemlju. Sola","1599.00 RSD"
"10409518268715","Dispanzer pića u obliku globusa — za zabave i dekoraciju","https://www.kupilica.com/products/dispanzer-pica-u-obliku-globusa-za-zabave-i-dekoraciju","https://cdn.shopify.com/s/files/1/0843/5738/2443/files/dispanzer-pica-u-obliku-globusa-za-zabave-i-dekoraciju-1.png?v=1780472985","Dispanzer pića u obliku globusa — dekoracija i šank u jednom ✅ Dekorativni globus — atraktivan dizajn za dnevnu sobu ili šank ✅ Providni rezervoar — vidite koje piće sipaju gosti ✅ Slavina za sipanje — pivo, koktel, sok — bez prevrtanja boce ✅ Atraktivno za zabave — uvek bude tema razgovora Dispanze","2550.00 RSD"
"9598064558379","Domino Vozić - 80 Delova","https://www.kupilica.com/products/domino-vozic","https://cdn.shopify.com/s/files/1/0843/5738/2443/files/Nenaslovljenidizajn_31_1.png?v=1721681513","DOMINO VOZIĆ SA 80 DOMINA Neka igra počne! ✓ Gledajte kako vaš mališan uživa u igri. ✓ Razvijajte kreativnost i veštine kroz zabavu. ✓ MAGIČNA IGRA SA DOMINAMA Pametni dizajn: Vozić koji automatski ispušta domine dok vozi - Savršeno postavljanje domina za beskrajne igre - Kvalitetni materijali: Izra","2160.00 RSD"
"9368701468971","Dron Silver EaglePro","https://www.kupilica.com/products/dron-silver-eaglepro","https://cdn.shopify.com/s/files/1/0843/5738/2443/files/s-l640_8198f63e-1be0-4ef5-9ecf-9124cee353c9.webp?v=1715164580","Napravite jedistvene i unikatne snimke iz ptičije perspektive. Dron Silver Eagle PRO sa WiFi HD kamerom dolazi u fabričkom pakovanju idealan za poklon i rekreaciju. Lako je sklopiv, tako da ga možete poneti bilo gdje, na putovanja, na odmor ili na izlete i tako ovekovečite svoje avanture vrhunskim H","3990.00 RSD"
"10410556457259","Dron W29HW sa kamerom — brushless motori, 6-kanalni","https://www.kupilica.com/products/dron-w29hw-sa-kamerom-brushless-motori-6-kanalni","https://cdn.shopify.com/s/files/1/0843/5738/2443/files/dron-w29hw-sa-kamerom-brushless-motori-6-kanalni-1.jpg?v=1780573086","Dron W29HW sa kamerom i brushless motorima — 6-kanalni daljinski ✅ Brushless motori — tiši i izdržljiviji od običnih — vek leta duži ✅ Kamera za snimanje iz vazduha — video i fotografije sa visine — uzbudljivo iskustvo ✅ 6-kanalni daljinski — precizna kontrola u svim pravcima — bolji za početnike ✅ ","4690.00 RSD"
"9368663720235","Držač za ubruse i folije sa policom sa začine","https://www.kupilica.com/products/drzac-za-ubruse-i-folije-sa-policom-sa-zacine","https://cdn.shopify.com/s/files/1/0843/5738/2443/files/342014623_515974290553803_1880308777732916884_n.jpg?v=1715162644","Raspolaže sa tri mesta za: alu foliju, prijanjajuću (plastičnu) foliju i kuhinjski ubrus. – Na gornjem delu poseduje malu policu pogodnu za drzanje zacina ili rezervne folije Proverena tehnologija sečenja. – Folije ne zapinju. – Ivice precizno isečene. – Jednostavno postavljanje folije i ubrusa","1799.00 RSD"
"10410555736363","DSP aparat za krofne 750W — 7 krofni odjednom","https://www.kupilica.com/products/dsp-aparat-za-krofne-750w-7-krofni-odjednom","https://cdn.shopify.com/s/files/1/0843/5738/2443/files/dsp-aparat-za-krofne-750w-7-krofni-odjednom-1.jpg?v=1780572808","DSP aparat za krofne 750W — peče 7 krofni istovremeno ✅ Snaga 750W — brzo zagrevanje, prve krofne gotove za 4 minuta ✅ Sedam krofni odjednom — cela porodica jede zajedno bez čekanja sledeće turne ✅ Non-stick premaz — krofne se vade prstom, ne lepe se za ploče ✅ Cool touch kućište — ručka ostaje hlad","3390.00 RSD"
"10409509585195","Dual kamera za video nadzor — AI detekcija + noćni senzor","https://www.kupilica.com/products/dual-kamera-za-video-nadzor-ai-detekcija-nocni-senzor","https://cdn.shopify.com/s/files/1/0843/5738/2443/files/dual-kamera-za-video-nadzor-ai-detekcija-nocni-senzor-1.webp?v=1780471685","Dual kamera sa dva sočiva, AI detekcijom ljudi i noćnim snimanjem do 30 m ✅ Dva sočiva istovremeno — 3,6 mm široki pregled i 6 mm fokusiran zoom u istom kadru ✅ AI prepoznavanje ljudi — alarm samo kada detektuje osobu, ne na granu koja se klati ✅ PTZ rotacija — 270° horizontalno, 90° vertikalno prek","4990.00 RSD"
"10410552754475","Dupli pokretni stalak za odeću sa čivilukom i policom","https://www.kupilica.com/products/dupli-pokretni-stalak-za-odecu-sa-civilukom-i-policom","https://cdn.shopify.com/s/files/1/0843/5738/2443/files/dupli-pokretni-stalak-za-odecu-sa-civilukom-i-policom-1.webp?v=1780571933","Dupli pokretni stalak za odeću sa čivilukom i policom — 110×57×150 cm ✅ Dva čiviluka — do 20 vešalica odjednom, dovoljno za jaknu, košulju i pantalone cele porodice ✅ Polica za obuću na dnu — patike i čizme ispod, jaknе iznad — sve na jednom mestu ✅ Točkići za pomeranje — pomerite ga kada čistite is","3999.00 RSD"
"10409513746731","Dupli ventilator za automobil — 360° rotacija, 12V upaljač","https://www.kupilica.com/products/dupli-ventilator-za-automobil-360-rotacija-12v-upaljac","https://cdn.shopify.com/s/files/1/0843/5738/2443/files/dupli-ventilator-za-automobil-360-rotacija-12v-upaljac-1.jpg?v=1780472627","Dva ventilatora sa 360° rotacijom — manje od 45 dB, priključuje se na auto upaljač ✅ Dvostruka glava sa rotacijom 360° — duva ka vozaču i suvozaču istovremeno ✅ Buka ispod 45 dB — tiše od običnog razgovora, ne ometa muziku ni razgovor ✅ Dve brzine — niska za održavanje sveže vazduha, jaka za vruće d","1890.00 RSD"
"9587088818475","Dusek - krevet za auto","https://www.kupilica.com/products/duse-krevet-za-auto","https://cdn.shopify.com/s/files/1/0843/5738/2443/files/KhHPCar-bed-SUV-car-inflatable-bed-air-cushion-bed-trunk-car-travel-bed-folding-bed-inflatable.jpg?v=1721213237","Super praktično rešenje za putovanja Krevet za auto koji će svaki Vaš put učitini još udobnijim. Deca ća ga obožavati, odrasli će odmoriti. Potpuno siguran Krevet se savršeno uklapa u gotovo svaki automobil zahvaljujući odličnom prilagodljivom dizajnu i svim zaštitama koje pokrivaju sve nezgodne ćoš","3799.00 RSD"
"9586989465899","Egg Sitter - Jastuk za udobno sedenje","https://www.kupilica.com/products/egg-sitter-jastuk-za-udobno-sedenje","https://cdn.shopify.com/s/files/1/0843/5738/2443/files/108299229_5ffa349a9005a0-47620402egg-sitter-3.jpg?v=1721210113","Pozdravite se sa bolovima, ukočenim mišićima uzrokovanim sedenjem tokom čitavog dana. Standardni jastuci za oslonac zahtevaju rupu koja je izrezana na jastuku da podrži vašu kost, ali ne i Egg sitter. On se savija i prilagođava vašoj repnoj kosti i oblikuje, apsorbujući tačke pritiska. Osećate bol u","1299.00 RSD"
"10409425142059","Električna automatska puška na vodu — letnja igračka","https://www.kupilica.com/products/elektricna-automatska-puska-na-vodu-letnja-igracka","https://cdn.shopify.com/s/files/1/0843/5738/2443/files/elektricna-automatska-puska-na-vodu-letnja-igracka-1.png?v=1780470613","Automatski mlaz vode — letnja igračka za vodene bitke u dvorištu ✅ Automatsko punjenje vode — bez ručnog pumpanja između mlazeva ✅ Konstantan mlaz — drži dugme, voda izlazi neprekidno ✅ Daleki domet — protivnik može da se gađa sa razdaljine ✅ Velika rezerva vode — manje vraćanja na slavinu za doliva","5999.00 RSD"
"10409513943339","Električna četka za čišćenje sa 7 nastavaka — 25W","https://www.kupilica.com/products/elektricna-cetka-za-ciscenje-sa-7-nastavaka-25w","https://cdn.shopify.com/s/files/1/0843/5738/2443/files/elektricna-cetka-za-ciscenje-sa-7-nastavaka-25w-1.jpg?v=1780472662","Električna četka 25W sa 7 nastavaka — riba fuge, kola, prozore i pločice ✅ Motor 25W — pritiskom na površinu rotacija ne pada, riba i tvrdokorne mrlje ✅ Sedam zamenskih glava — fini ćoškovi, fuge, krupne površine, mekani vlazi za prozore ✅ Dve produžne ručke — dohvata do plafona i ispod nameštaja be","2790.00 RSD"
"10409424945451","Električni aparat za čišćenje ribe — 2 baterije, bežični","https://www.kupilica.com/products/elektricni-aparat-za-ciscenje-ribe-2-baterije-bezicni","https://cdn.shopify.com/s/files/1/0843/5738/2443/files/elektricni-aparat-za-ciscenje-ribe-2-baterije-bezicni-1.webp?v=1780470575","Krljušt nestaje za nekoliko sekundi — bez nereda i ručnog struganja ✅ Rotirajuća glava — skida krljušt brzo i ravnomerno, ne preskače komade ✅ Dve baterije u kompletu — neprekidan rad za veći ulov ili pripremu obroka ✅ Bez prskanja krljušti po kuhinji — zaštita zadržava ostatke uz aparat ✅ Vodootpor","2490.00 RSD"
"9941291073835","Električni Česalj protiv vaši- Zaštitite vaše dete na vreme!","https://www.kupilica.com/products/elektricni-cesalj-zastitite-vase-dete-na-vreme","https://cdn.shopify.com/s/files/1/0843/5738/2443/files/2_7fb7d94b-afd9-42e7-b9f4-19dcdd122fb0.png?v=1743105890","ZABRINUTI STE DA ĆE DETE DOBITI VAŠKE? Zaboravite brige, recite zbogom vašima! ✓ Jednostavno, bezbedno, efikasno! ✓ Zaštitite svoje najmilije s lakoćom. ✓ ELEKTRIČNI ČEŠALJ PROTIV VAŠI Savršen saveznik u borbi protiv vaši! LED svetlo plave boje za bolju vidljivost i preciznost. USB punjenje za nepre","1999.00 RSD"
"10409519251755","Električni grill 750W sa nelepljivom pločom","https://www.kupilica.com/products/elektricni-grill-750w-sa-nelepljivom-plocom","https://cdn.shopify.com/s/files/1/0843/5738/2443/files/elektricni-grill-750w-sa-nelepljivom-plocom-1.jpg?v=1780473042","Električni grill 750W sa nelepljivom pločom — pljeskavica za 4 minuta ✅ Snaga 750W — zagrevanje za 3 minuta, pljeskavica gotova za 4 minuta po strani ✅ Nelepljiva ploča — meso klizi, mast ide u žljeb, ne lepi se za površinu ✅ Termostat sa indikatorom — održava optimalnu temperaturu, ne pregreva meso","2600.00 RSD"
"10409519186219","Električni pištolj na vodu — veliki, domet 9 m","https://www.kupilica.com/products/elektricni-pistolj-na-vodu-veliki-domet-9-m","https://cdn.shopify.com/s/files/1/0843/5738/2443/files/elektricni-pistolj-na-vodu-veliki-domet-9-m-1.png?v=1780473034","Električni pištolj na vodu sa dometom 9 m — 40 minuta neprekidne igre ✅ Domet do 9 m lučno, 7 m pravo — pogađa metu sa drugog kraja dvorišta ✅ Punjiva baterija 500 mAh — 40 minuta neprekidne pucnjave po jednom punjenju ✅ Punjenje rezervoara za 30 sekundi — uroni u kantu vode, dugmeta povuče vodu ✅ R","2990.00 RSD"
"10409519120683","Električni tiganj za palačinke Sokany PRO sa mućkalicom","https://www.kupilica.com/products/elektricni-tiganj-za-palacinke-sokany-pro-sa-muckalicom","https://cdn.shopify.com/s/files/1/0843/5738/2443/files/elektricni-tiganj-za-palacinke-sokany-pro-sa-muckalicom-1.webp?v=1780473024","Sokany PRO aparat za palačinke 650W sa mućkalicom — bez okretanja u tiganju ✅ Snaga 650W — zagrevanje za 2 minuta, prva palačinka gotova za 4 minuta ✅ Nelepljiva ploča 20 cm — ne traži ulje, palačinka klizi sama ✅ Mućkalica u kompletu — ravnomerno se nanosi testo, debljina palačinke isto ✅ Bez prevr","2250.00 RSD"
"10409422487851","Evropska utičnica sa USB i USB-C portovima","https://www.kupilica.com/products/evropska-uticnica-sa-usb-i-usb-c-portovima-2-komada","https://cdn.shopify.com/s/files/1/0843/5738/2443/files/evropska-uticnica-sa-usb-i-usb-c-portovima-2-komada-1.webp?v=1780469827","Evropska utičnica sa USB i USB-C portovima ✅ Dve utičnice u paketu — jedna za dnevnu sobu, druga za spavaću ili kuhinju ✅ USB i USB-C izlaz — punite telefon i Type-C uređaj bez adaptera ✅ Snaga do 2500W — nosi i kuhinjske aparate, ne samo telefone ✅ 16A trenutno — sigurno za standardno domaće instal","1500.00 RSD"
"9586988810539","False Teeth - smesa za razmake izmedju zuba","https://www.kupilica.com/products/false-teeth-smesa-za-razmake-izmedju-zuba","https://cdn.shopify.com/s/files/1/0843/5738/2443/files/1_796260ef-d1b6-4ea6-9b95-69bf3d1966d3.jpg?v=1721210081","FALSE TEETH - Napredna formula za dugotrajno popunjavanje Neka vaš osmeh zasija punim sjajem sa False Teeth . Naša specijalno formulirana smesa pruža ne samo efikasno popunjavanje, već i osigurava da vaši zubi izgledaju prirodno i negovano. Lepši i puniji osmeh False Teeth jača vaše zube i popunjava","1499.00 RSD"
"10409420882219","Fen za kosu bez lopatica — turbinski dizajn","https://www.kupilica.com/products/fen-za-kosu-bez-lopatica-turbinski-dizajn","https://cdn.shopify.com/s/files/1/0843/5738/2443/files/fen-za-kosu-bez-lopatica-turbinski-dizajn-1.png?v=1780469456","Brzo sušenje kose bez visokog šuma i bez klasičnih lopatica ✅ Bez rotirajućih lopatica — dizajn sa otvorenim prstenom, bez opasnosti da kosa upadne u mehanizam ✅ Brzo sušenje — jak protok vazduha skraćuje vreme sušenja na par minuta ✅ Tiše od klasičnog fena — turbina umesto velikog ventilatora, manj","4990.00 RSD"
"10396873294123","Fiksna 3G Lovačka Kamera – HC 300","https://www.kupilica.com/products/fiksna-3g-lovacka-kamera","https://cdn.shopify.com/s/files/1/0843/5738/2443/files/fiksna-3g-lovacka-kamera-pregled.jpg?v=1779628033","Automatsko snimanje divljači — aktivira se na pokret, baterija traje mesecima ✅ Noćni vid — infracrvene LED diode snimaju u potpunom mraku bez vidljivog svetla ✅ Brzo okidanje — kamera se aktivira za manje od 1 sekunde od detekcije pokreta ✅ Dugotrajne baterije — 1920×1080 (Full HD) baterija traje m","11990.00 RSD"
"10396872278315","Fiksna 3G Lovačka Kamera – HC – 801","https://www.kupilica.com/products/fiksna-3g-lovacka-kamera-hc-801","https://cdn.shopify.com/s/files/1/0843/5738/2443/files/fiksna-3g-lovacka-kamera-hc-pregled_8c7ec326-6ded-4200-95ca-8acb317fb5b8.jpg?v=1779627909","Automatsko snimanje divljači — aktivira se na pokret, baterija traje mesecima ✅ Noćni vid — infracrvene LED diode snimaju u potpunom mraku bez vidljivog svetla ✅ Brzo okidanje — kamera se aktivira za manje od 1 sekunde od detekcije pokreta ✅ Dugotrajne baterije — 1920×1080 (Full HD) baterija traje m","13990.00 RSD"
"10396871754027","Fiksna 4G Lovačka Kamera HC – 880Pro","https://www.kupilica.com/products/fiksna-4g-lovacka-kamera-hc-880pro","https://cdn.shopify.com/s/files/1/0843/5738/2443/files/fiksna-4g-lovacka-kamera-hc-pregled_33166624-27ee-44df-b125-b32211b3bc75.jpg?v=1779627829","Automatsko snimanje divljači — aktivira se na pokret, baterija traje mesecima ✅ Noćni vid — infracrvene LED diode snimaju u potpunom mraku bez vidljivog svetla ✅ Brzo okidanje — kamera se aktivira za manje od 1 sekunde od detekcije pokreta ✅ Dugotrajne baterije — 2K ( 2048 x 1080) baterija traje mes","13990.00 RSD"
"10396876833067","Fiksna 4G Solarna Lovačka Kamera – HC 808 – UCON","https://www.kupilica.com/products/fiksna-4g-solarna-lovacka-kamera-hc-808","https://cdn.shopify.com/s/files/1/0843/5738/2443/files/fiksna-4g-solarna-lovacka-kamera-pregled_07099828-37bb-4fbf-9dda-2e5533581aa8.jpg?v=1779628448","Automatsko snimanje divljači — aktivira se na pokret, baterija traje mesecima ✅ Noćni vid — infracrvene LED diode snimaju u potpunom mraku bez vidljivog svetla ✅ Brzo okidanje — kamera se aktivira za manje od 1 sekunde od detekcije pokreta ✅ Dugotrajne baterije — 1920×1080 (Full HD) baterija traje m","12990.00 RSD"
"10396873621803","Fiksna 4G Solarna Lovačka Kamera – QC1","https://www.kupilica.com/products/fiksna-4g-solarna-lovacka-kamera","https://cdn.shopify.com/s/files/1/0843/5738/2443/files/fiksna-4g-solarna-lovacka-kamera-pregled_daee5325-520d-4bb4-9592-3e42ab9d29fa.jpg?v=1779628071","Automatsko snimanje divljači — aktivira se na pokret, baterija traje mesecima ✅ Noćni vid — infracrvene LED diode snimaju u potpunom mraku bez vidljivog svetla ✅ Brzo okidanje — kamera se aktivira za manje od 1 sekunde od detekcije pokreta ✅ Dugotrajne baterije — 1920×1080 (Full HD) baterija traje m","12690.00 RSD"
"10396876636459","Fiksna 4G Solarna Lovačka Kamera – UCON","https://www.kupilica.com/products/fiksna-4g-solarna-lovacka-kamera-1","https://cdn.shopify.com/s/files/1/0843/5738/2443/files/fiksna-4g-solarna-lovacka-kamera-pregled.jpg?v=1779628425","Automatsko snimanje divljači — aktivira se na pokret, baterija traje mesecima ✅ Noćni vid — infracrvene LED diode snimaju u potpunom mraku bez vidljivog svetla ✅ Brzo okidanje — kamera se aktivira za manje od 1 sekunde od detekcije pokreta ✅ Dugotrajne baterije — 1280 x 720 ( HD ) baterija traje mes","11990.00 RSD"
"10396871328043","Fiksna Solar­na Wi-Fi Kamera – Jortan 2T","https://www.kupilica.com/products/fiksna-solar-na-wi-fi-kamera-jortan-2t","https://cdn.shopify.com/s/files/1/0843/5738/2443/files/fiksna-solar-na-wi-fi-pregled_911e4253-2849-4580-a21b-e5ac5d3ce6b0.jpg?v=1779627791","Solarno napajanje, Wi-Fi prenos — bez struje, bez montažera ✅ Solarni panel — 3W panel puni bateriju tokom dana, kamera radi noću ✅ Wi-Fi konekcija — prenos slike na mobilnu aplikaciju bez mrežnog kabla ✅ 1920×1080 (Full HD) rezolucija — jasna slika i tokom noći zahvaljujući IR diodama ✅ Bežična mon","6990.00 RSD"
"10409519284523","Filter prečišćivač vode za kuhinjsku česmu — keramički, 7 slojeva","https://www.kupilica.com/products/filter-preciscivac-vode-za-kuhinjsku-cesmu-keramicki-7-slojeva","https://cdn.shopify.com/s/files/1/0843/5738/2443/files/filter-preciscivac-vode-za-kuhinjsku-cesmu-keramicki-7-sloje-1.png?v=1780473051","Sedmoslojni filter za česmu — keramički, 0,1 mikron preciznost, perivi ✅ Sedam slojeva filtracije — uklanja hlor, rđu, talog, mikročestice i mnoge bakterije ✅ Keramički filter 0,1 mikron — visok nivo čistoće, preciznije od većine kućnih sistema ✅ Periv, ne baca se — ispiranje na svakih 7–10 dana, go","1490.00 RSD"
"10410555605291","Fitnes trambolina 48"" (122 cm) — sklopiva, 250 kg","https://www.kupilica.com/products/fitnes-trambolina-48-122-cm-sklopiva-250-kg","https://cdn.shopify.com/s/files/1/0843/5738/2443/files/fitnes-trambolina-48-122-cm-sklopiva-250-kg-1.png?v=1780572777","Fitnes trambolina 48"" (122 cm) — sklopiva, nosivost 250 kg ✅ Prečnik 122 cm (48"") — dovoljno za odrasle, ne za male igračke trambolinе ✅ 32 elastične trake — stabilan i siguran skok, ne škripi posle mesec dana ✅ Nosivost do 250 kg — podržava dvoje odraslih ili krupne korisnike ✅ Sklopiva za odlaganj","6190.00 RSD"
"9587078299947","Flasteri protiv hrkanja","https://www.kupilica.com/products/flasteri-protiv-hrkanja","https://cdn.shopify.com/s/files/1/0843/5738/2443/files/2_35669629-d915-4112-8925-3018fe2fd967.jpg?v=1721212959","Nasalni trake Breathe Ease su fleksibilni trakovi od tkanine s oprugom koji nežno podižu i otvaraju nos za poboljšan protok vazduha, pomažući vam da dišete bolje. Instantno olakšanje za začepljen nos koji može nastati usled prehlade, alergija ili devijacije septuma. Pomaže u smanjenju hrkanja za bol","999.00 RSD"
"9587090391339","Fleksibilna prskalica sa 12 nastavaka","https://www.kupilica.com/products/fleksibilna-prskalica-sa-12-nastavaka","https://cdn.shopify.com/s/files/1/0843/5738/2443/files/main-image-1_2ada78a1-9cea-4edf-864b-40519c61c75b.jpg?v=1721213283","Opis Leta su sve toplija a vašem travnjaku je potrebno redovno zalivanje i da pritom to bude ravnomerno zalivanje po celom travnjaku. Upravo ovakav efekat ćete dobiti sa novom univerzalnom FLEXI prskalicom. DUGOTRAJAN VEK TRAJANJA Vašem baštenskom crevu ovo je neophodno, a moći će da vam služi još d","999.00 RSD"
"9371107590443","Fotoaparat za decu","https://www.kupilica.com/products/fotoaparat-za-decu","https://cdn.shopify.com/s/files/1/0843/5738/2443/files/foto-aparat-za-decu-2.webp?v=1715241059","Ovo je zapravo prava kamera upakovana u ovako zanimljiv dizajn za mališane. Ima dva moda rada. Može da snima i da slika. Ukoliko uključite mode za slikanje, možete dodati i neke efekte na sliku. Ugrađeno je i par igrica. Podržava memorisku karticu do 32 gb. Kad mališanima slikanje dosadi, fotoaparat","2500.00 RSD"
"8863967478059","Galaktička projektor lampa 8u1","https://www.kupilica.com/products/galakticka-projektor-lampa-8u1","https://cdn.shopify.com/s/files/1/0843/5738/2443/files/5_c4d8b26c-4617-4d16-aedb-53ab15992722.png?v=1699521457","Neka vaši najmlađi dožive čarobno galaktičko iskustvo -8 različitih projekcija- -4 nivoa osvetljenje- -2 režima rada(sa zvezdicama i bez)- Napravite magičan ambijent u vašem domu 1.Projektuje galaksije visoke definicije 2.Ulepšava svaki prostor 3.Podiže raspoloženje Ambijent lampa idealna za svaku v","1990.00 RSD"
"10409421078827","Gel za uklanjanje buđi sa pločica i silikona","https://www.kupilica.com/products/gel-za-uklanjanje-budi-sa-plocica-i-silikona","https://cdn.shopify.com/s/files/1/0843/5738/2443/files/gel-za-uklanjanje-budi-sa-plocica-i-silikona-1.png?v=1780469493","Gel ostavljate preko noći — buđ iz fuga nestaje bez ribanja ✅ Direktno na fugne — gusta tekstura ostaje na vertikalnim površinama bez kapanja ✅ Bez ribanja — formula radi sama dok ostavite gel da deluje ✅ Sigurno za kupatilo i kuhinju — bez agresivnih isparenja koja zatvaraju prozore na sat vremena ","990.00 RSD"
"9587089178923","Gnezdo ljuljaska","https://www.kupilica.com/products/stella-ljuljaska-za-dvoriste-i-terasu","https://cdn.shopify.com/s/files/1/0843/5738/2443/files/main-image-1_40d24457-5c36-4bf7-8b27-771a9dd8a0e6.jpg?v=1721213251","Ulepšajte terasu ili vrt sa ovom prelepom ljuljaškom. Ljuljaška za terasu je napravljena od metalne konstrukcije, pletenog kanapa tako da je veoma izdržljiva. Naravno, ovo nije samo ljuljaška za terasu , možete je postaviti gde god vi želite. Na vrhu ima metalne alke za kačenje tako da je možete zak","3499.00 RSD"
"9587091210539","Gnječilica za Beli Luk","https://www.kupilica.com/products/gnjecilica-za-beli-luk-1","https://cdn.shopify.com/s/files/1/0843/5738/2443/files/1-pieces-stainless-steel-garlic-press-ma_main-1.jpg?v=1721213301","Zgnječite i naseckajte beli luk uz minimalan napor! Beli luk je nesumnjivo najaromatičniji začin na svetu. Jednostavno ne postoji zamena za taj prepoznatljivi ukus koji uzdiže gotovo svako jelo u svakoj kuhinji. Ali koliko god volite taj ukus belog luka, ne želite ga na rukama! Neka se ova laka pres","799.00 RSD"
"8915158860075","Grejač auto sedišta 12v","https://www.kupilica.com/products/grejac-auto-sedista-12v","https://cdn.shopify.com/s/files/1/0843/5738/2443/files/1_686388e8-c875-49c8-acff-831df7b7b3e8.png?v=1702296239","ODLIČNO REŠENJE DA VAM BUDE TOPLO OVE ZIME - greje sedište za 30 sekundi - - udobno - -lako se montira i čisti - IZUZETNA UDOBNOST I GREJANJE U VOŽNJI 1. I zrađena od visokokvalitetnih grejnih vlakana 2. Puni se preko upaljača u autu na 12v 3. Vodootporna podloga POBOLJŠANI POLOŽAJ SEDENJA Nudi potp","1590.00 RSD"
"10410605084971","Grejna ploča sa keramičkom šoljom — USB, auto-isključenje","https://www.kupilica.com/products/grejna-ploca-sa-keramickom-soljom-usb-auto-iskljucenje","https://cdn.shopify.com/s/files/1/0843/5738/2443/files/grejna-ploca-sa-keramickom-soljom-usb-auto-iskljucenje-1.webp?v=1780581141","Grejna ploča sa keramičkom šoljom — održava kafu, čaj i mleko na željenoj temperaturi ✅ USB napajanje — radi preko USB porta na laptopu, power banku, auto adapteru ✅ Keramička šolja u paketu — kompletan set, ne morate posebno da kupujete ✅ Tiha grejna spirala — bez ventilatora, ne smeta dok radite ✅","1900.00 RSD"
"9587080331563","Himalajska kristalna lampa","https://www.kupilica.com/products/himalajska-kristalna-lampa","https://cdn.shopify.com/s/files/1/0843/5738/2443/files/main-image-1_2_b62c43f0-d380-4052-8b25-323cdea23c25.jpg?v=1721213010","Lampe od ružičaste himalajske soli, poslednjih godina postale su prava atrakcija u сvetu pa i kod nas. Himalajske slane lampe su ručno isklesani blokovi himalajske soli, koji potiču iz dubokih podzemnih rudnika na zapadnoj strani Himalajskih planina u Pakistanu. Slane himalajske lampe, osim dekorati","1999.00 RSD"
