"ID","Item title","Final URL","Image URL","Item description","Price"
"9368611815723","Maska za ronjenja sa dodatkom za gopro","https://www.kupilica.com/products/maska-za-ronjenja-sa-dodatkom-za-gopro","https://cdn.shopify.com/s/files/1/0843/5738/2443/files/viber_image_2021-08-03_12-47-59.jpg?v=1715159811","Profesionalna maska za ronjenje koja prekriva celo lice. Poseduje držač za GoPro kameru. Obezbedjuje izuzetan vidik od 180° . Specijalan raspored komora onemogućava magljenje. Možete disati i na nos i na usta a u isto vreme ne morate držati nikakvu cevku u ustima. . . Cev je priključena direktno na ","2499.00 RSD"
"9368623546667","Maskirni šator za kampovanje","https://www.kupilica.com/products/maskirni-sator-za-kampovanje","https://cdn.shopify.com/s/files/1/0843/5738/2443/files/6_45ecf4b5-9083-4bc7-85f4-bc24cfc6d087.png?v=1773937784","🏕️ VAŠA NEPROBOJNA TVRĐAVA U PRIRODI – SPREMNA ZA 2 MINUTA! Dosta vam je komplikovanih šatora, savijenih šipki i sati izgubljenih na uputstva koja nemaju smisla? Zamislite zaklon koji nudi maksimalnu zaštitu , a postavlja se brže nego što skuvate kafu. Predstavljamo vam taktički maskirni šator nove ","3500.00 RSD"
"9587040878891","Meda koji diše uz muziku i svetlo","https://www.kupilica.com/products/meda-koji-dise-uz-muziku-i-svetlo","https://cdn.shopify.com/s/files/1/0843/5738/2443/files/2_14bf8b6a-e8fd-493c-9ca3-57247980ae87.jpg?v=1721211951","Magični pratilac za vašu bebu Tražite idealnu igračku koja će vašem mališanu doneti smirenost i udobnost? Upoznajte najnoviji član našeg asortimana - Med koji diše, svetli i svira uspavanku. Umirujuće disanje i nežna muzika Ova jedinstvena plišana igračka dolazi sa neverovatnim sposobnostima. Njen","2199.00 RSD"
"8867042754859","Meda skrivalica","https://www.kupilica.com/products/meda-skrivalica","https://cdn.shopify.com/s/files/1/0843/5738/2443/files/5_105f2b54-d26f-4728-85b4-75a4bc1a4794.png?v=1699732284","Ultimativni interaktivni plišani drugar za vašeg mališana - Mekan i nežan - - Interaktivan zvuk - - Podržava zdrav razvoj dečijeg mozga - Izaziva smeh i radost kod vašeg deteta 1. Plišani meda voli da podigne ćebence i sakrije se iza njega, tako će i deca vežbati skrivanje zajedno sa njim! 2. Meda o","1990.00 RSD"
"10409520726315","Mehanička rampa za parking sa ključem — čelična","https://www.kupilica.com/products/mehanicka-rampa-za-parking-sa-kljucem-celicna","https://cdn.shopify.com/s/files/1/0843/5738/2443/files/mehanicka-rampa-za-parking-sa-kljucem-celicna-1.webp?v=1780473385","Čelična parking rampa sa ključem — osmougaona, instalacija za 30 minuta ✅ Osmougaona čelična konstrukcija — otporna na udar i pokušaj nasilnog savijanja ✅ Sigurnosna brava sa ključem — samo vlasnik može da je podigne ili spusti ✅ Jedan čovek je obara i podiže — bez pomoći, mehanizam je olakšan oprug","3000.00 RSD"
"9817266880811","Memorijska kartica","https://www.kupilica.com/products/memorijska-kartica","https://cdn.shopify.com/s/files/1/0843/5738/2443/files/Memorijske_kartice_1.jpg?v=1733302595","Memorijska kartica 32 i 64gb","1000.00 RSD"
"9025019117867","Mesalica-mikser za mesanje farbe, kreca, fasade","https://www.kupilica.com/products/mesalica-mikser-za-mesanje-farbe-kreca-fasade","https://cdn.shopify.com/s/files/1/0843/5738/2443/files/IMG-e7cdf159858174c941c7446aa3f32c21-V.jpg?v=1707155583","‘-Visenamenska mesalica -Mešalica za mešanje boja, lepkova, gipsa, maltera, smole i drugih materijala -Snaga 2000w -Brzina obrtaja: 1200r/min","4500.00 RSD"
"10409511289131","Mikrofiber krpe za čišćenje — set od 2 komada","https://www.kupilica.com/products/mikrofiber-krpe-za-ciscenje-set-od-2-komada","https://cdn.shopify.com/s/files/1/0843/5738/2443/files/mikrofiber-krpe-za-ciscenje-set-od-2-komada-1.png?v=1780472156","Dve krpe od mikrovlakana koje čiste samo vodom — bez sredstava i tragova ✅ Čišćenje bez hemikalija — voda i krpa rade isti posao kao deterdžent na većini površina ✅ Ne ostavlja tragove ni dlačice — staklo i ogledala posle brisanja izgledaju kao polirana ✅ Upijanje veće od pamuka — guste niti drže pr","850.00 RSD"
"9990873383211","Mini dron gt3","https://www.kupilica.com/products/mini-dron-gt3","https://cdn.shopify.com/s/files/1/0843/5738/2443/files/slider_images_6_6a42bcc1-0cc5-4f20-8cb7-67affc1f5776.jpg?v=1748860760","Otkrijte slobodu letenja: Vaš savršeni dron za neverovatne avanture! Zaboravite na brigu, uživajte u letu! Naš revolucionarni dron donosi potpunu sigurnost zahvaljujući potpuno zatvorenom dizajnu propelera , štiteći vas i vašu okolinu. Sa svojom kompaktnom veličinom i lakoćom prenosivosti , vaš novi","3999.00 RSD"
"10409424814379","Mini Lifter — alat za uklanjanje udubljenja na karoseriji","https://www.kupilica.com/products/mini-lifter-alat-za-uklanjanje-udubljenja-na-karoseriji","https://cdn.shopify.com/s/files/1/0843/5738/2443/files/mini-lifter-alat-za-uklanjanje-udubljenja-na-karoseriji-1.jpg?v=1780470564","Vakum metod sa toplim lepkom — udubljenja nestaju bez bojenja ✅ Vakum povlačenje — izvlači udubljenje iznutra bez doticanja boje ✅ Topao lepak u kompletu — fiksira nastavak na karoseriju, ne ostavlja trag ✅ Više nastavaka — različite veličine za male, srednje i veće deformacije ✅ Bez plaćanja autoli","3200.00 RSD"
"9587053756715","Mini prenosiva klima","https://www.kupilica.com/products/mini-prenosiva-klima","https://cdn.shopify.com/s/files/1/0843/5738/2443/files/3_fd65aa6f-8d5a-4304-af60-0e7019d8031d.jpg?v=1721212292","KREIRAJTE SOPSTVENU ZONU KOMFORA Efikasna u hlađenju prostora i čuvanju energije! Ekološka Za razliku od ostalih klima ne sadrži freon i ostale supstance koje štete okolini. Laka upotreba Sve što treba da uradite jeste da sipate vodu u klimu i spremna je za korišćenje. Izuzetno brzo hlađenje Zahvalj","1599.00 RSD"
"10410554917163","Mini sportska kamera 1080P WiFi — magnetni privezak","https://www.kupilica.com/products/mini-sportska-kamera-1080p-wifi-magnetni-privezak","https://cdn.shopify.com/s/files/1/0843/5738/2443/files/mini-sportska-kamera-1080p-wifi-magnetni-privezak-1.png?v=1780572470","Mini sportska kamera 1080P WiFi — magnetni privezak, vodootporna ✅ Kompaktna 64,5×28×20 mm — staje u džep, kači se za odeću ili kacigu ✅ Magnetni privezak + rotirajuća kopča 360° — postavi je gde želiš, snima u svakom uglu ✅ Vodootporna školjka u kompletu — ronjenje, plivanje, kiša — sve podržano ✅ ","4290.00 RSD"
"10410557440299","Mini sto sa policom za časopise — multifunkcionalan","https://www.kupilica.com/products/mini-sto-sa-policom-za-casopise-multifunkcionalan","https://cdn.shopify.com/s/files/1/0843/5738/2443/files/mini-sto-sa-policom-za-casopise-multifunkcionalan-1.webp?v=1780573388","Mini sto sa policom za časopise — elegantan, multifunkcionalan ✅ Polica za časopise — prostor za knjige, časopise, ukrase ispod radne površine ✅ Elegantan dizajn — staje uz dvosed, fotelju ili krevet kao bočni sto ✅ Multifunkcionalan — kafa pored kauča, lampa pored kreveta, ukrasi u kancelariji ✅ Sk","2190.00 RSD"
"9380202905899","Mini telefon","https://www.kupilica.com/products/mini-telefon","https://cdn.shopify.com/s/files/1/0843/5738/2443/files/1698431015-Hee1597b5d324464483372f8bde19c4c1N.jpg?v=1715500726","Potpuno funkcionalan telefon za pozivanje, primanje poziva, slanje i primanje SMS poruka. Ima bluetooth povezivanje, imenik, istoriju poziva, poseduje audio snimanjem.. Telefon ima dva slota za sim kartice (Dual sim), radi na svim mrežama (Sim free) Poseduje slot za mikroSD karticu, sa koje se može ","1990.00 RSD"
"10410597810475","Mrežasti filter za odvod — sprečava začepljenje","https://www.kupilica.com/products/mrezasti-filter-za-odvod-sprecava-zacepljenje","https://cdn.shopify.com/s/files/1/0843/5738/2443/files/mrezasti-filter-za-odvod-sprecava-zacepljenje-1.jpg?v=1780580534","Mrežasti filter za odvod — zaustavlja kosu i ostatke, sprečava začepljenje cevi ✅ Mrežasta konstrukcija — propušta vodu, zaustavlja kosu i sitne ostatke ✅ Lepljivi nosač — montira se za par sekundi, bez bušenja ✅ Jednokratna upotreba sa zamenjivim filterima — vadi se i baca u kantu ✅ Standardna veli","1199.00 RSD"
"10410551509291","Mrežice za odvod sudopere — 20 komada","https://www.kupilica.com/products/mrezice-za-odvod-sudopere-20-komada","https://cdn.shopify.com/s/files/1/0843/5738/2443/files/71C0JYsIBYL._AC_SL1200_00b1f10d-757b-429e-95b0-e364c4ff4216.jpg?v=1780591460","Mrežice za odvod sudopere — 20 komada, zaustavljaju kosu i ostatke hrane ✅ 20 komada u pakovanju — meseci upotrebe, jedna mrežica dnevno za sudoperu ✅ Univerzalna veličina — pristaje na svaki standardni odvod u sudoperi i tušu ✅ Sprečava začepljenje — hvata ostatke hrane, dlake, masti pre nego što u","999.00 RSD"
"10042677559595","Multifunkcionalne krpe za čišćenje 5+5 gratis","https://www.kupilica.com/products/multifunkcionalne-krpe-za-ciscenje-5-5-gratis","https://cdn.shopify.com/s/files/1/0843/5738/2443/files/3_7d37d223-81f8-4ee7-aab0-d95d5591dfbc.webp?v=1754226155","Izuzetna efikasnost u čišćenju Ova žičana krpa za čišćenje je vaš novi najbolji saveznik u kuhinji! Zahvaljujući svom jedinstvenom dizajnu, savršeno uklanja tvrdokorne masnoće i ostatke hrane sa posuđa, šporeta, sudopera i drugih površina. Nema više napornog trljanja – uz minimalan napor dobijate be","990.00 RSD"
"10410555703595","Multifunkcionalni paročistač 2500W — bez hemikalija","https://www.kupilica.com/products/multifunkcionalni-parocistac-2500w-bez-hemikalija","https://cdn.shopify.com/s/files/1/0843/5738/2443/files/multifunkcionalni-parocistac-2500w-bez-hemikalija-1.jpg?v=1780572798","Multifunkcionalni paročistač 2500W — bez hemikalija, šest jačina pare ✅ Snaga 2500W — veća od većine kućnih modela — para se proizvodi brže, čisti dublje ✅ Šest nivoa jačine pare — fine za osetljive površine, jako za zagorelo ✅ Više nastavaka u kompletu — pločice, kupatilo, kuhinja, prozori, dušek —","3290.00 RSD"
"10409420194091","Multifunkcionalni privezak alat — lampa, otvarač, odvijač, upaljač","https://www.kupilica.com/products/multifunkcionalni-privezak-alat-lampa-otvarac-odvijac-upaljac","https://cdn.shopify.com/s/files/1/0843/5738/2443/files/multifunkcionalni-privezak-alat-lampa-otvarac-odvijac-upalja-1.jpg?v=1780469051","Pet alata u privesku — lampa, otvarač, odvijač, upaljač i karabiner ✅ COB LED lampa — ravnomeran snop koji obasja motor, gepek ili šator bez senki ✅ USB punjenje — puni se sa istog kabla kao telefon, ne traži posebne baterije ✅ Karabiner sa gumom — kači se za pojas, ranac ili ključeve i ostaje fiksi","1390.00 RSD"
"9371293745451","Municija za pistolj za lemljenje plastike","https://www.kupilica.com/products/municija-za-pistolj-za-lemljenje-plastike","https://cdn.shopify.com/s/files/1/0843/5738/2443/files/municija-za-pistolj-za-lemljenje-plastike-500-komada-pametna-kupovina-34496227443005_720x720_c02a5c65-de15-40e4-8f6c-ab3b96304fd4.webp?v=1715245131","Set od 500 komada municije za pištolj namenjenog lemljenju plastike. Svaki komad odlikuje visok kvalitet i preciznost, čineći lemljenje bržim i efikasnijim. Ovaj set je idealan za profesionalnu upotrebu u radionici, ali i za hobi entuzijaste koji traže pouzdane materijale za svoje projekte. Uz ovu o","999.00 RSD"
"10410554753323","Muški poklon set 5u1 — naočare, novčanik, sat, kaiš, olovka","https://www.kupilica.com/products/muski-poklon-set-5u1-naocare-novcanik-sat-kais-olovka","https://cdn.shopify.com/s/files/1/0843/5738/2443/files/muski-poklon-set-5u1-naocare-novcanik-sat-kais-olovka-1.webp?v=1780572426","Muški poklon set 5u1 — naočare, novčanik, sat, kaiš, olovka ✅ Pet komada u kompletu — naočare, novčanik, sat, kaiš i kvalitetna olovka — kompletan set ✅ Eko koža + legura + mesing — kvalitetni materijali, ne raspada se posle mesec dana ✅ Klasičan dizajn — funkcioniše uz odelo, košulju, džemper — bez","2500.00 RSD"
"10410553114923","Muški poklon set 5u1 — sat, kaiš, novčanik, naočare","https://www.kupilica.com/products/muski-poklon-set-5u1-sat-kais-novcanik-naocare","https://cdn.shopify.com/s/files/1/0843/5738/2443/files/muski-poklon-set-5u1-sat-kais-novcanik-naocare-1.jpg?v=1780571989","Muški poklon set 5u1 — sat, naočare, kaiš, novčanik, privezak u poklon kutiji ✅ Pet komada u jednom paketu — kompletan set za stiliziranog muškarca — bez kombinovanja različitih poklona ✅ Poklon kutija uključena — spreman za poklon, ne treba dodatno pakovanje ✅ Klasičan dizajn — boje i materijal koj","2990.00 RSD"
"10176576618795","Muzicka lokomotiva sa deda mrazom i simulacijom snega","https://www.kupilica.com/products/muzicka-lokomotiva-sa-deda-mrazom-i-simulacijom-snega","https://cdn.shopify.com/s/files/1/0843/5738/2443/files/8dca49_bc8f3764a8f846f086cc3a3a0b79b75a_mv2.avif?v=1764922247","Svetleća muzička dekoracija sa efektom padajućeg snega 🚂✨ ❄️ Šta nedostaje klasičnim prazničnim dekoracijama? Mnogi ukrasi izgledaju lepo, ali nemaju onu čaroliju koja zaista oživi prostor. Bez pokreta, svetlosti i emocije, teško je stvoriti toplu prazničnu atmosferu koja mami osmeh svakom ko uđe u ","4490.00 RSD"
"10176574325035","Muzički TV sa deda mrazom i simulacijom snega","https://www.kupilica.com/products/muzicki-tv-sa-deda-mrazom-i-simulacijom-snega","https://cdn.shopify.com/s/files/1/0843/5738/2443/files/8dca49_183ad6529b644372a8966aefc66a0195_mv2.avif?v=1764921872","Retro Muzička Novogodišnja Kutija – Vintage TV koji oživljava zimsku bajku ✨🎅 ❄️ Šta nedostaje većini prazničnih dekoracija? Mnogi novogodišnji ukrasi deluju lepo, ali ne stvaraju onu toplu, živu atmosferu koju želimo tokom praznika. Bez pokreta, svetlucanja i magije – prostor ostaje bez pravog praz","3500.00 RSD"
"10410607575339","MX10 Android TV Box — pretvara TV u smart, 4K UHD","https://www.kupilica.com/products/mx10-android-tv-box-pretvara-tv-u-smart-4k-uhd","https://cdn.shopify.com/s/files/1/0843/5738/2443/files/mx10-android-tv-box-pretvara-tv-u-smart-4k-uhd-1.png?v=1780581416","MX10 Android TV Box — stari TV postaje smart, 4K Ultra HD streaming sa YouTube-a i Netflix-a ✅ Pretvara običan TV u smart — HDMI port + ovo i imate Android sistem ✅ 4K Ultra HD — najveća rezolucija koju TV podržava ✅ YouTube, Netflix, druge aplikacije — preko Google Play-a se instalira sve ✅ Interne","2890.00 RSD"
"9587049693483","Nasloni za glavu","https://www.kupilica.com/products/nasloni-za-glavu","https://cdn.shopify.com/s/files/1/0843/5738/2443/files/0_b51c274e-7598-42d0-a8d3-37679f452cbe.jpg?v=1721212185","BEZ UKOČENOSTI VRATA Da li Vam se ikada desilo da odspavate u automobilu, ali kada stignete na odredište, probudite se sa bolovima ili ukočenim vratom? Da, to je grozno - i često se to dešava kada nemate odgovarajuću podršku za vrat. Naši jastuci za glavu za sedište automobila menjaju to, pružajući ","2099.99 RSD"
"9368656773419","Nastavak za šrafilicu-lisičarka testera","https://www.kupilica.com/products/nastavak-za-srafilicu-lisicarka-testera","https://cdn.shopify.com/s/files/1/0843/5738/2443/files/viber_image_2022-01-24_10-55-29-731.jpg?v=1715162335","Fenomenalan dodatak pretvara vašu šrafilicu ili bušilicu u testeru za drvo ili metal u roku od jednog minuta Poseduje mehanizam za menjanje sečiva koji se pokreće pomoću poluge,brzo zamenite sečiva bez upotrebe dodatnih alata Mogu se rezati različiti materijali: sečenje drveta, sečenje čeličnih ce","1699.00 RSD"
"9587055755563","Nevidljivi jastučići za povećanje visine","https://www.kupilica.com/products/jastucici-za-povecanje-visine","https://cdn.shopify.com/s/files/1/0843/5738/2443/files/ei-d-plantilla-invisible-de-silicona-2-en_main-0.jpg?v=1721212351","Neprimetno povećanje visine Postanite za nekoliko centimetara viši bez da to primete i drugi. Izuzetna udobnost Osećajte se kao da hodate po najmekšoj travi bosim nogama. Nevidljivi ispod čarapa Potpuno se priljubljuju uz Vaše stopalo, stapaju se s njim tako da i kada obujete čarape Vaša noga izgled","799.00 RSD"
"9368731746603","Nindža nož-glava za trimer","https://www.kupilica.com/products/nindza-noz-glava-za-trimer","https://cdn.shopify.com/s/files/1/0843/5738/2443/files/Ninja-Blade-nastavak-za-trimer-sa-6-nozeva-600x600.webp?v=1715165820","Glava za trimer sa 6 pokretnih noževa za košenje trave, rastinja, šikare… Nož je izrađen od visokokvalitetnih materijala i veoma je izdržljiv Nož je univerzalan, centralna rupa je prečnika 2,54 cm (1 inč) Odgovara trimerima Demon, Prolinetech, Stihl, Echo, Husqvarna i još mnogim drugim Nož je previđ","1350.00 RSD"
"9587058016555","NOVOGODIŠNJA LED ZAVESA 3x3m","https://www.kupilica.com/products/novogodisnja-led-zavesa-3x2m","https://cdn.shopify.com/s/files/1/0843/5738/2443/files/71ck5ku_Y2L._AC_SX679_8cd51050-feef-459e-9e76-a1feb186d3a1.jpg?v=1721212410","NOVOGODIŠNJA LED ZAVESA Nema više zamršenih kablova, raznih malih i velikih lampiona i spajanja kako bi dobili savršeno okićenu kuću i dvorište. Zavesa koja svetli je nešto što će vam olakšati život! Samo je postavite na mesto na koje želite, uključite u struju i soba ili dvorište će dobiti drugu di","1999.00 RSD"
"10409511551275","Novogodišnja lokomotiva sa Deda Mrazom i irvasima","https://www.kupilica.com/products/novogodisnja-lokomotiva-sa-deda-mrazom-i-irvasima","https://cdn.shopify.com/s/files/1/0843/5738/2443/files/novogodisnja-lokomotiva-sa-deda-mrazom-i-irvasima-1.jpg?v=1780472183","Novogodišnja lokomotiva sa svetlosnim efektima i Deda Mrazom u kabini ✅ Svetlosni efekti — LED dioda u kabini i prozorima vagona menjaju boje u ritmu ✅ Napajanje na baterije ili kabl — stoji ispod jelke gde ima utičnice, ili na polici na baterijama ✅ Deda Mraz i tri irvasa — Rudolf na čelu, kompozic","5000.00 RSD"
"10410604921131","NutriBullet blender/sokovnik — smoothie i sok","https://www.kupilica.com/products/nutribullet-blender-sokovnik-smoothie-i-sok","https://cdn.shopify.com/s/files/1/0843/5738/2443/files/nutribullet-blender-sokovnik-smoothie-i-sok-1.jpg?v=1780581125","NutriBullet blender i sokovnik u jednom — smoothie i sok za 30 sekundi ✅ Blender + sokovnik — dva uređaja u jednom, štedi prostor na radnoj ploči ✅ Snažan motor — drobi led, smrznuto voće, orasi bez zaustavljanja ✅ Posude za put — pravi se smoothie, pije se iz iste posude na poslu ✅ Sečivo nerđajući","4990.00 RSD"
"9587030294827","Opustajući jastuk za vrat","https://www.kupilica.com/products/opustajuci-jastuk-za-vrat","https://cdn.shopify.com/s/files/1/0843/5738/2443/files/main-image-1_2_25791f7b-f3be-400e-8988-1fd02ac68e5c.jpg?v=1721211651","Smanjuje bolove u vratu i ramenima Ovaj uređaj za istezanje vrata pomaže u smanjenju bolova u vratu, pruža olakšanje od napetosti u vratu, umanjuje dosadne glavobolje i migrene, te vraća pravilnu posturu vratnog dela kičme. Ekološki materijali za maksimalnu udobnost Jastuk za masažu vrata izrađen je","1299.00 RSD"
"9023346082091","Oralni irigator-Električni aparat za čišćenje desni i zuba","https://www.kupilica.com/products/elektricni-aparat-za-ciscenje-desni-i-zuba","https://cdn.shopify.com/s/files/1/0843/5738/2443/files/135046212_624854c19b0d35-41340831image.jpg?v=1707127873","Brzo i jednostavno isperite zube i desni pomocu ovog ispiraca. Samo napunite vodom ili sredstvom za ispiranje usta i usmerite i pritisnite da biste očistili prljavstinu i ostatke hrane izmedju zuba i desni Vazduh pravi pritisak i voda nezno uklanja ostatke hrane. Negujte svoje desni i zube, pogotovu","1999.00 RSD"
"9368696029483","Organizator polica ispod sudopere","https://www.kupilica.com/products/organizator-polica-ispod-sudopere","https://cdn.shopify.com/s/files/1/0843/5738/2443/files/112340-n-k-nas-w-klasik-korejski-stilu-nerdajuceg-celika-multi-funkcionalni-sudoperi-rack-bijele.jpg?v=1715164284","Multifunkcionalna polica za ispod sudopere je savršeno rešenje za organizaciju vaše kuhinje. Napravljena od visokokvalitetnih materijala, ova polica je stabilna, čvrsta i izdržljiva, pružajući vam dugotrajnu upotrebu. Uz ovu policu možete efikasno iskoristiti prostor ispod sudopere, oslobađajući vaš","1990.00 RSD"
"10410557309227","Organizer za nakit sa fiokama i providnim odeljcima","https://www.kupilica.com/products/organizer-za-nakit-sa-fiokama-i-providnim-odeljcima","https://cdn.shopify.com/s/files/1/0843/5738/2443/files/organizer-za-nakit-sa-fiokama-i-providnim-odeljcima-1.webp?v=1780573359","Organizer za nakit sa fiokama — providni odeljci za pregledan raspored ✅ Više fioka za organizaciju — minđuše, prstenje, ogrlice, narukvice — svaka kategorija svoj prostor ✅ Providni deo za pregled — vidiš šta gde stoji bez vađenja fioke ✅ Štedi prostor toaletnog stola — sve na jednom mestu umesto r","1800.00 RSD"
"10410557341995","Organizer za šminku sa ogledalom","https://www.kupilica.com/products/organizer-za-sminku-sa-ogledalom","https://cdn.shopify.com/s/files/1/0843/5738/2443/files/organizer-za-sminku-sa-ogledalom-1.jpg?v=1780573369","Organizer za šminku sa ogledalom — kompletno rešenje za toaletni sto ✅ Ogledalo integrisano — ne treba odvojeno stojeće ogledalo na stolu ✅ Pregrade za šminku, parfeme, četkice — sve kategorije u svom prostoru ✅ Moderan dizajn — akril ili providna plastika — elegantan dodatak prostora ✅ Praktično za","2190.00 RSD"
"10410557407531","Organizer za šminku sa ogledalom i 2 fioke","https://www.kupilica.com/products/organizer-za-sminku-sa-ogledalom-i-2-fioke","https://cdn.shopify.com/s/files/1/0843/5738/2443/files/organizer-za-sminku-sa-ogledalom-i-2-fioke-1.jpg?v=1780573379","Organizer za šminku sa ogledalom i 2 fioke — kompaktna verzija ✅ Dve fioke za odlaganje — puder, ruževi, senke, četkice — svaka kategorija svoj prostor ✅ Ogledalo na vrhu — praktično za šminkanje bez okretanja glave ✅ Kompaktne dimenzije — staje na komodu bez zauzimanja prostora ✅ Lakša verzija od v","1990.00 RSD"
"10396872900907","P12 Wi-Fi PTZ Kamera sa 3 sočiva","https://www.kupilica.com/products/wi-fi-ptz-kamera-sa-3-sociva","https://cdn.shopify.com/s/files/1/0843/5738/2443/files/wi-fi-ptz-kamera-sa-pregled.jpg?v=1779627993","Rotacija 355° i 4K rezolucija — pokriva ceo prostor bez slepih tački ✅ Detekcija pokreta — push notifikacija na telefon u trenutku detekcije, bez kašnjenja ✅ 4K rezolucija — jasna slika i u noćnom modu zahvaljujući IR diodama ✅ Wi-Fi konekcija — prenos slike na mobilnu aplikaciju bez mrežnog kabla ✅","7990.00 RSD"
"9368692916523","Pačiji tobogan","https://www.kupilica.com/products/paciji-tobogan","https://cdn.shopify.com/s/files/1/0843/5738/2443/files/61L31QIeGYL._AC_UF1000_1000_QL80.jpg?v=1726812391","IGRAČKA ZA PENJANJE PO STEPENICAMA - PAČIJI TOBOGAN Unesite radost i zabavu u svaki dan!✓ Gledajte kako vaša deca uživaju u igri.✓ Razvijajte kreativnost i motoričke veštine kroz igru.✓ NEODOLJIVA ZABAVA ZA DECU Pametni dizajn: Električna patka koja se sama penje po stepenicama - Automatski se vraća","1490.00 RSD"
"10410605248811","Paint Roller valjak za krečenje — sa rezervoarom za boju","https://www.kupilica.com/products/paint-roller-valjak-za-krecenje-sa-rezervoarom-za-boju","https://cdn.shopify.com/s/files/1/0843/5738/2443/files/paint-roller-valjak-za-krecenje-sa-rezervoarom-za-boju-1.webp?v=1780581156","Paint Roller valjak za krečenje sa rezervoarom — boja se dozira sama, bez kapanja ✅ Integrisani rezervoar za boju — sipa se u dršku, valjak vuče sam dok kreči ✅ Bez kapanja na pod — kontrolisana doza znači čistiji posao ✅ Stiže do uglova — dizajn dohvaća detalje koje obični valjci propuštaju ✅ Brže ","1490.00 RSD"
"10410596827435","Pametna kanta sa senzorom pokreta — bez dodira","https://www.kupilica.com/products/pametna-kanta-sa-senzorom-pokreta-bez-dodira","https://cdn.shopify.com/s/files/1/0843/5738/2443/files/pametna-kanta-sa-senzorom-pokreta-bez-dodira-1.webp?v=1780580456","Pametna kanta sa senzorom pokreta — poklopac se sam otvara, ruke ostaju čiste ✅ Senzor pokreta — poklopac se otvara čim ruka pređe iznad, bez dodira ✅ Tih rad — motor radi tiho, ne smeta noću u kuhinji ✅ Baterijsko napajanje — 4 baterije AA traju 6 meseci pri normalnoj upotrebi ✅ Lako čišćenje — gor","2199.00 RSD"
"10397580788011","Pametna LED Lampa LUX","https://www.kupilica.com/products/pametna-led-lampa-lux","https://cdn.shopify.com/s/files/1/0843/5738/2443/files/pametna-led-lampa-lux-pregled.jpg?v=1779627271","Kontrolišeš svetlo telefonom — bez ustajanja, bez prekidača ✅ Glasovna kontrola — radi sa Alexa i Google Assistant naredbama ✅ Tuya aplikacija — podesite boju, jačinu i raspored sa telefona ✅ 355° rotacija glave — svetlo ide tačno tamo gde treba ✅ RGB traka + 10 nivoa jačine — od radnog svetla do am","6990.00 RSD"
"10397592748331","Pametna LED Plafonska Lampa WiFi 24W RGB App Kontrola","https://www.kupilica.com/products/pametna-led-plafonska-lampa-wifi-tuya-24w","https://cdn.shopify.com/s/files/1/0843/5738/2443/files/pametna-led-plafonska-lampa-wifi-pregled_b91b8f2b-93f8-4551-a175-61d579743821.jpg?v=1779627294","24W LED rasveta za ceo stan — 30.000 sati bez zamene sijalice ✅ Puni RGB spektar — 16 miliona boja, od hladne radne svetlosti do opuštajuće boje večeri ✅ Glasovna kontrola — radi sa Alexa i Google Home, bez potrebe za daljinskim ✅ Sinhronizacija sa muzikom — svetlost automatski prati ritam pesme ✅ 3","5290.00 RSD"
