"ID","Item title","Final URL","Image URL","Item description","Price"
"10393990070571","Set za gradnju tvrđave 68 delova — štapići i kuglice za decu 3+","https://www.kupilica.com/products/set-za-gradnju-tvrdave-68-delova-stapici-i-kuglice-za-decu-3","https://cdn.shopify.com/s/files/1/0843/5738/2443/files/108f313b1f1880168cf5107947881c74b355fcfff9633bc87572e6be1297f446__46149.1684334058.jpg?v=1779292605","30 dana reklamacija bez pitanja Plaćanje pouzećem Dostava 1–3 radna dana Graditeljski set za decu od 68 delova (44 plastična štapića i 24 kuglice-konektora) koji dete sklapa u dvorac, tunel, raketu ili tvrđavu. Završena konstrukcija meri 101×53×101 cm — dovoljno velika da dete uđe unutra. Bez lepka,","2500.00 RSD"
"10409508340011","Set za otvaranje vina — somelijer komplet u poklon kutiji","https://www.kupilica.com/products/set-za-otvaranje-vina-somelijer-komplet-u-poklon-kutiji","https://cdn.shopify.com/s/files/1/0843/5738/2443/files/set-za-otvaranje-vina-somelijer-komplet-u-poklon-kutiji-1.webp?v=1780471305","Komplet za otvaranje vina sa srebrnim somelijerom, sečivom folije i čepom ✅ Pun set u poklon kutiji — vadilica, sečivo, prsten protiv kapanja, čep ✅ Vadi pluto bez lomljenja — somelijer model sa zglobnim lakatom, polugom od metala ✅ Sečivo za foliju — čista linija, ne ostavlja rezigle koje upadaju u","2190.00 RSD"
"9587018957099","Set za podizanje namestaja","https://www.kupilica.com/products/set-za-podizanje-namestaja","https://cdn.shopify.com/s/files/1/0843/5738/2443/files/1_e425d478-a596-41f4-9c58-c8ff731494ab.jpg?v=1721211342","Zadržite svoj oslonac! Više nećete zavisiti od jače polovine kako biste pomerili krevet, ormar ili frižider. Sada to možete postići samostalno! Efikasnost uz brzinu Uštedite dragoceno vreme i poštedite svoje telo dodatnog fizičkog napora! 👉 Prilagodljivi podizači Gornji deo podizača se rotira za 360","1299.00 RSD"
"9368624529707","Set Za Vodenu Maglu – Hladjenje Terasa i Otvorenih Prostora","https://www.kupilica.com/products/set-za-vodenu-maglu-hladjenje-terasa-i-otvorenih-prostora","https://cdn.shopify.com/s/files/1/0843/5738/2443/files/IMG-cd01a4cd36fbfc7d6f02811a1fba0633-V.jpg?v=1719096488","Jednostavno, efikasno, jeftino, ekonomično, mobilno/prenosivo uz brzu ugradnju „sam svoj majstor“. Umesto da se u letnim mesecima povučete u klimatizovanu sobu, možete uživati na svojoj terasi u vrtu ili na balkonu uz spoljašnju klimu koja vodenom parom snižava temperaturu vazduha 5 i više stepeni. ","1200.00 RSD"
"9587024953643","SHIATSU Jastuk - Prenosivi masažer","https://www.kupilica.com/products/shiatsu-jastuk-prenosivi-masazer","https://cdn.shopify.com/s/files/1/0843/5738/2443/files/massage-pillow-8-d-head-infrared-heating_main-1.jpg?v=1721211510","JEDINSTVENA ŠIJACU MASAŽA Kombinacija tehnika stiskanja i zagrevanja obezbediće potpuno opuštanje tela i ublažavanje bolova. Koristite ga bilo gde na telu da biste ublažili bol. OSEĆAJ JE PRAVI, KAO MASAŽA RUKAMA Grejna glava i tehnika kružnog stiskanja pružaju osećaj masaže rukama. PRIUŠTITE SEBI O","1999.00 RSD"
"10409509650731","Shiatsu jastuk — masažer sa grejanjem za vrat i leđa","https://www.kupilica.com/products/shiatsu-jastuk-masazer-sa-grejanjem-za-vrat-i-leda","https://cdn.shopify.com/s/files/1/0843/5738/2443/files/shiatsu-jastuk-masazer-sa-grejanjem-za-vrat-i-leda-1.jpg?v=1780471695","Shiatsu jastuk koji oponaša masažu rukama uz grejanje za vrat i leđa ✅ Četiri rotirajuće glave — kruže u oba smera, kao masaža prstima ✅ Funkcija grejanja — toplota stimuliše cirkulaciju i opušta napete mišiće ✅ Prenosiv — autopunjač u kompletu, koristi u kolima na dugim putovanjima ✅ Za sve delove ","1899.00 RSD"
"9380917051691","Sigurnosna 4k Dual kamera za Video nadzor sa AI detekcijom i sirenom 8x Zoom","https://www.kupilica.com/products/ip-kamera-ptz-kamera-sa-3-sociva-i-sirenom-4k-8x-zoom","https://cdn.shopify.com/s/files/1/0843/5738/2443/files/Ip_kamera_PTZ_kamera_sa_2_sociva_i_sirenom_4k_8x_zoom.webp?v=1778489633","Sigurnosna kamera sa dvostrukim sočivima postavlja nove standarde u video nadzoru. Dve kamere Sirena 8x Zoom Dvosmerna komunikacija AI detekcija pokreta Sa inovativnom dual sočivima, AI detekcijom (veštačkom inteligencijom) ljudi i vodootpornom kućištem, ova kamera garantuje izvanredno precizno nadg","4490.00 RSD"
"10410553016619","Silikonski filter za odvod — set od 4 komada","https://www.kupilica.com/products/silikonski-filter-za-odvod-set-od-4-komada","https://cdn.shopify.com/s/files/1/0843/5738/2443/files/silikonski-filter-za-odvod-set-od-4-komada-1.jpg?v=1780571976","Silikonski filter za odvod — set od 4 komada sa jednosmernim ventilom ✅ Jednosmerni ventil — voda otiče napolje, kanalizacioni gasovi i insekti ne dolaze nazad ✅ Set od 4 komada — dovoljno za sudoperu, dva lavaboa, tuš ili kadu odjednom ✅ Silikonski materijal — fleksibilan, prilagodljiv različitim v","890.00 RSD"
"10410553180459","Sklopiva mini veš mašina 6,6 L — za putovanja","https://www.kupilica.com/products/sklopiva-mini-ves-masina-6-6-l-za-putovanja","https://cdn.shopify.com/s/files/1/0843/5738/2443/files/sklopiva-mini-ves-masina-6-6-l-za-putovanja-1.webp?v=1780571999","Sklopiva mini veš mašina 6,6 L — za putovanja, kamping i male prostore ✅ Sklopiva konstrukcija — kad ne radi, sklopi se i staje u ormar — ne zauzima prostor stalno ✅ Kapacitet 6,6 litara — dovoljno za 1-2 majice ili donji veš za dvoje za dan ✅ Ultrazvučne vibracije — bez gužvanja tkanine, bezbedno z","2999.00 RSD"
"10410597384491","Sklopiva ručna testera — za grane do 10 cm","https://www.kupilica.com/products/sklopiva-rucna-testera-za-grane-do-10-cm","https://cdn.shopify.com/s/files/1/0843/5738/2443/files/sklopiva-rucna-testera-za-grane-do-10-cm-1.webp?v=1780580503","Sklopiva ručna testera — staje u džep ili ranac, otvara se za 2 sekunde ✅ Sklapanje za par sekundi — sečivo se zatvara u ručku, ne sečka u rancu ✅ Tvrdi čelik sa zubima na obe strane — pili grane do 10 cm prečnika ✅ Ergonomska ručka — prirubnica protiv klizanja, ne otkliza pri jakom pritisku ✅ Bezbe","1199.00 RSD"
"10398098293035","Sklopivi dron sa HD kamerom V88 Pro","https://www.kupilica.com/products/sklopivi-dron-sa-hd-kamerom-v88-pro","https://cdn.shopify.com/s/files/1/0843/5738/2443/files/S5bbe20b6cd80405db8912c3ad2cbaeef2.jpg?v=1779529477","Dron koji se nauci za 10 minuta — bez prethodnog iskustva ✅ Sklopivi krakovi — stane u ranac, spreman za let za 30 sekundi ✅ Opticki senzor polozaja — drzi visinu bez GPS-a, ne treba ga stalno korigovati ✅ 10-15 minuta leta po bateriji, domet 100 metara ✅ 1080P HD kamera — snima video i fotografise ","2990.00 RSD"
"9935124922667","Sklopivi krevet","https://www.kupilica.com/products/sklopivi-krevet","https://cdn.shopify.com/s/files/1/0843/5738/2443/files/1_3e6626f1-76e8-46f9-b3df-f20198e1b3a0.png?v=1743445748","Tražite prenosivi krevet za goste ili kampovanje? Spavajte udobno, gde god da ste! ✓ Kada udobnost i praktičnost idu ruku pod ruku. ✓ Idealno rešenje za putovanja, kampovanje, ili kada gosti iznenade. ✓ SKLOPIVI KREVET ZA SVE PRILIKE Zaboravite na tvrde podloge i neudobne improvizacije! Ovaj prenosi","7000.00 RSD"
"9371101921579","Smart satić Q528 sa GPS praćenjem","https://www.kupilica.com/products/smart-satic-q528-sa-gps-pracenjem","https://cdn.shopify.com/s/files/1/0843/5738/2443/files/AGPS-LBS-pracenje.webp?v=1715240917","U bilo kom trenutku možete znati gde se nalazi vaše dete. Smart satić Q528 ima ugrađen GPS traker, tako da preko aplikacije možete pratiti kretanje vašeg deteta. Pored funkcije praćenja, sat ima mogućnost slanja glasovnih i tekstualnih poruka. Nešto više o funkcijama ćemo u daljem delu teksta. Smart","2790.00 RSD"
"10409506144555","SmartCam sijalica 360° — WiFi kamera u E27 grlu, 4MP","https://www.kupilica.com/products/smartcam-sijalica-360-wifi-kamera-u-e27-grlu-4mp","https://cdn.shopify.com/s/files/1/0843/5738/2443/files/smartcam-sijalica-360-wifi-kamera-u-e27-grlu-4mp-1.png?v=1780471058","WiFi kamera koja se zavrće kao sijalica — bez kablova i bušenja ✅ 4MP HD rezolucija — jasna slika danju i u noćnom režimu u boji ✅ Rotacija 350° horizontalno, 100° vertikalno — pokriva celu prostoriju iz jedne tačke ✅ Auto-tracking pokreta — kamera prati osobu koja prolazi i šalje push obaveštenje ✅","2990.00 RSD"
"10313362571563","Smile-Perfect Formula","https://www.kupilica.com/products/smile-perfect-formula","https://cdn.shopify.com/s/files/1/0843/5738/2443/files/1_fa0d1029-6fd7-4d2c-9509-a2d3f0de77f4.png?v=1774702127","Vratite samopouzdanje svakom fotografijom! 📸 Neka vaš osmeh ponovo zablista onako kako zaslužujete. Predstavljamo vam Smile-Perfect Formula – vaše tajno oružje za besprekoran izgled u svakoj prilici. Bilo da se spremate za važno slavlje, sastanak ili jednostavno želite da se osećate bolje, ovo je re","1599.00 RSD"
"10042688078123","Sofa na naduvavanje šarena","https://www.kupilica.com/products/sofa-na-naduvavanje-sarena","https://cdn.shopify.com/s/files/1/0843/5738/2443/files/image_1.webp?v=1754229890","Uživajte u maksimalnoj udobnosti uz naš premium naduvni sofa set! Izrađen od kvalitetnog PVC materijala sa mekanom flokiranom površinom, ovaj set je izdržljiv, siguran i otporan na oštećenja. Višenamenska upotreba – Lagan i prenosiv, savršen je za dnevni boravak, spavaću sobu, balkon, baštu, kampova","3990.00 RSD"
"10410555670827","Sokany SK-08027 dupli aparat za vafle 1400W","https://www.kupilica.com/products/sokany-sk-08027-dupli-aparat-za-vafle-1400w","https://cdn.shopify.com/s/files/1/0843/5738/2443/files/sokany-sk-08027-dupli-aparat-za-vafle-1400w-1.jpg?v=1780572789","Sokany SK-08027 dupli aparat za vafle — 1400W, dva vafla istovremeno ✅ Snaga 1400W — brzo zagrevanje, prvi vafl gotov za 3-4 minuta ✅ Dvostruka radna površina — dva vafla istovremeno — porodica jede zajedno bez čekanja ✅ Non-stick premaz — ne lepi se za ploče, čišćenje krpom posle ✅ LED indikatori —","3800.00 RSD"
"10396877324587","Solarna 4G Kamera sa 2 sočiva TP13B","https://www.kupilica.com/products/solarna-dvostruka-4g-kamera","https://cdn.shopify.com/s/files/1/0843/5738/2443/files/solarna-dvostruka-4g-kamera-pregled.jpg?v=1779628506","Nadzor bez struje i bez Wi-Fi — solarni panel i 4G SIM, radi bilo gde ✅ Solarno napajanje — solarni panel 3W puni bateriju tokom dana, nema struje iz zida ✅ 4G konekcija — koristi SIM karticu umesto Wi-Fi — postavljate na udaljenim lokacijama ✅ 2K ( 2048 x 1080) rezolucija — jasna slika i danju i no","8990.00 RSD"
"10396874309931","Solarna 4G Kamera sa 3 sočiva TP 3010","https://www.kupilica.com/products/solarna-trostruka-4g-kamera","https://cdn.shopify.com/s/files/1/0843/5738/2443/files/solarna-trostruka-4g-kamera-pregled.jpg?v=1779628183","Nadzor bez struje i bez Wi-Fi — solarni panel i 4G SIM, radi bilo gde ✅ Solarno napajanje — solarni panel 3W puni bateriju tokom dana, nema struje iz zida ✅ 4G konekcija — koristi SIM karticu umesto Wi-Fi — postavljate na udaljenim lokacijama ✅ 1920×1080 (Full HD) rezolucija — jasna slika i danju i ","10990.00 RSD"
"10396875260203","Solarna Fiksna Wi – Fi kamera","https://www.kupilica.com/products/solarna-fiksna-wi-fi-kamera","https://cdn.shopify.com/s/files/1/0843/5738/2443/files/solarna-fiksna-wi-fi-kamera-pregled_95a2baeb-64f9-432f-9da0-0fe72af84727.jpg?v=1779628278","Solarno napajanje, Wi-Fi prenos — bez struje, bez montažera ✅ Solarni panel — 3W panel puni bateriju tokom dana, kamera radi noću ✅ Wi-Fi konekcija — prenos slike na mobilnu aplikaciju bez mrežnog kabla ✅ 1920×1080 (Full HD) rezolucija — jasna slika i tokom noći zahvaljujući IR diodama ✅ Bežična mon","5990.00 RSD"
"9368649597227","Solarna fontana","https://www.kupilica.com/products/solarna-fontana","https://cdn.shopify.com/s/files/1/0843/5738/2443/files/2194f8bb-8e6a-4678-88ad-4e47be6f5c58.jpg?v=1715161894","🌞 Želite li mirnu oazu u svom dvorištu? ✨ Umorni ste od betonske monotonije i žudite za daškom prirode i opuštanja? Zamislite: vaša terasa postaje mirno utočište, a bazen izgleda kao scena iz magazina. Dosta je bilo sanjanja – vreme je za akciju! SOLARNA FONTANA KOJA MENJA SVE Solarna fontana je mno","1690.00 RSD"
"10397710811435","Solarna Fontana za Baštu 6 Mlaznica 45cm Bez Kabla","https://www.kupilica.com/products/solarna-fontana-6-mlaznica-45cm-max-mlaz","https://cdn.shopify.com/s/files/1/0843/5738/2443/files/solarna-fontana-6-mlaznica-45cm-pregled_972203d1-5372-4ff9-be84-a262dcfa76ff.jpg?v=1779627317","6 mlaznica, 45 cm visine mlaza i nula troška struje — fontana radi čim sunce zasvetli ✅ 100% solarno napajanje — nema kabla, nema baterije, nema troška — pumpa radi direktno sa sunca ✅ 6 različitih mlaznica — svaka daje drugačiji efekat vodenog mlaza, od lotosa do ravnog stuba ✅ Max 45 cm visine mla","2690.00 RSD"
"10409508929835","Solarna lampa ClipLight — 72 LED, štipaljka, senzor pokreta","https://www.kupilica.com/products/solarna-lampa-cliplight-72-led-stipaljka-senzor-pokreta","https://cdn.shopify.com/s/files/1/0843/5738/2443/files/solarna-lampa-cliplight-72-led-stipaljka-senzor-pokreta-1.png?v=1780471474","Solarna lampa sa štipaljkom — kači se za ogradu, šator ili granu bez bušenja ✅ 72 LED diode, do 50 m² — pokriva dvorište, parking ili prilaz ulazu ✅ Štipaljka umesto šrafova — kači se za ogradu, drvo, šator, garažna vrata ✅ Senzor pokreta — pali se sama kad neko prođe, gasi se kad nema kretanja ✅ IP","1590.00 RSD"
"9368633573675","Solarna Lampa LED Solarne led lampe za baštu 10 komada","https://www.kupilica.com/products/solarna-lampa-led-solarne-led-lampe-za-bastu-10-komada","https://cdn.shopify.com/s/files/1/0843/5738/2443/files/113349742_60616b6386fd17-193672001616997130274-2.jpg?v=1715160965","HIT na trzistu su solarne lampe od nerdjajuceg celika! Po ceni datoj u oglasu dobijate kvalitetnu lampu, koja preko solarne ploce - celije puni bateriju i kada senzor dan-noc registruje da vise nema svetlosti za punjenje, automatski aktivira svetla! Lampa je otporna na rdjanje kao i sve vremenske us","2000.00 RSD"
"9998365491499","Solarna lampa sa efektom plamena","https://www.kupilica.com/products/solarna-lampa-sa-efektom-plamena","https://cdn.shopify.com/s/files/1/0843/5738/2443/files/sl.webp?v=1749716896","Radi sama celu noć — bez utičnice, bez žice, bez trošenja baterija ✅ Svetli celu noć bez dopunjavanja — solarni panel puni Li-ion bateriju tokom dana, baklja svetli do 8 sati sama ✅ Stoji vani po kiši bez zaštite — IP65 znači da rosa, kiša i prskanje je ne isključuju ni ne oštećuju ✅ Ne morate je uk","1690.00 RSD"
"10409509028139","Solarna lampa sa setom alata 2u1 — 16 alata, COB, USB","https://www.kupilica.com/products/solarna-lampa-sa-setom-alata-2u1-16-alata-cob-usb","https://cdn.shopify.com/s/files/1/0843/5738/2443/files/solarna-lampa-sa-setom-alata-2u1-16-alata-cob-usb-1.png?v=1780471491","Solarna lampa sa setom od 16 alata u jednoj kutiji — za auto, garažu i kamp ✅ 16-delni set alata — šrafcigeri, klješta, nož, traka, ključevi u kompaktnoj kutiji ✅ Tri režima svetla — belo, crveno i SOS signal za upozorenje ✅ Bočno i prednje COB svetlo — osvetljava ispred i sa strane istovremeno ✅ So","1990.00 RSD"
"10397613490475","Solarna LED Baklja Efekat Plamena Dvorište Automatska","https://www.kupilica.com/products/solarna-led-baklja-sa-efektom-plamena","https://cdn.shopify.com/s/files/1/0843/5738/2443/files/solarna-led-baklja-sa-efektom-pregled_4b2c3f93-c999-4aca-b15f-d393fb2cb464.jpg?v=1779627327","Solarna baklja sa efektom plamena — pali se sama svake večeri bez struje i kablova ✅ Efekat pravog plamena — LED diode imitiraju pokretni plamen za dekorativan ambijent u bašti ✅ Senzor dan/noć — automatski se uključuje u sumrak i gasi u zoru bez ručnog upravljanja ✅ IP65 vodootpornost — radi u kiši","1890.00 RSD"
"10409510928683","Solarna LED lampa 106 LED sa senzorom pokreta — 800 lumena, IP65","https://www.kupilica.com/products/solarna-led-lampa-106-led-sa-senzorom-pokreta-800-lumena-ip65","https://cdn.shopify.com/s/files/1/0843/5738/2443/files/solarna-led-lampa-106-led-sa-senzorom-pokreta-800-lumena-ip6-1.png?v=1780472073","Solarna LED lampa 106 dioda — 800 lumena, vodootporna, sa senzorom pokreta ✅ 106 LED dioda, 800 lumena — snažno svetlo dovoljno da osvetli ulaz, garažu i prilaz ✅ Odvojen solarni panel — panel ide na sunce, lampa na željeno mesto bez kompromisa ✅ Senzor pokreta — pali se samo kada prepozna kretanje,","1990.00 RSD"
"10397712974123","Solarna LED Lampa LUX-6 – Set od 4 Lampe","https://www.kupilica.com/products/solarna-led-lampa-lux-6","https://cdn.shopify.com/s/files/1/0843/5738/2443/files/solarna-led-lampa-lux-6-pregled.jpg?v=1779627347","4 solarne lampe, 8 LED po komadu i IP65 — staza i travnjak osvetljeni bez kablova i električne energije ✅ Set od 4 lampe LUX-6 — osvetljava celu stazu, cvjetnjak ili rub dvorišta jednom kupovinom ✅ 8 LED dioda belo svetlo — jasno, ravnomerno osvetljenje svakog dela staze ✅ IP65 vodootpornost — ukopa","3690.00 RSD"
"10397713432875","Solarna LED Lampa LUX-618","https://www.kupilica.com/products/solarna-led-lampa-lux-618","https://cdn.shopify.com/s/files/1/0843/5738/2443/files/solarna-led-lampa-lux-618-pregled.jpg?v=1779627360","Zidna solarna lampa sa senzorom sumraka i pokreta — pali se sama, radi i na oblačno ✅ 1500mAh Li-ion baterija — dovoljno za više uzastopnih noći čak i bez sunca ✅ Dupli senzor: sumrak + pokret — automatski se pali, aktivira jači sjaj na pokret ✅ Polisilikonski panel — puni se i pri slabom svetlu, ob","2890.00 RSD"
"10397622632747","Solarna LED Lampa LUX-7 – Set od 6 Lampi","https://www.kupilica.com/products/solarna-led-lampa-lux-7","https://cdn.shopify.com/s/files/1/0843/5738/2443/files/solarna-led-lampa-lux-7-pregled.jpg?v=1779627371","Set od 6 solarnih lampi sa izrezbarenim zvezdama i mesecem — igra svetla i senki bez struje ✅ Izrezbareni motivi zvezda i meseca — bacaju dekorativne senke na okolne površine tokom noći ✅ Set od 6 komada — dovoljno za stazu, terasu ili baštenski krug bez doplate ✅ IP44 vodootpornost — radi u kiši, o","4690.00 RSD"
"10397626630443","Solarna LED Lampa LUX-8 – Set od 6 Lampi","https://www.kupilica.com/products/solarna-led-lampa-lux-8","https://cdn.shopify.com/s/files/1/0843/5738/2443/files/solarna-led-lampa-lux-8-pregled.jpg?v=1779627400","Set od 6 minimalističkih solarnih lampi — 8-10 sati automatskog osvetljenja staza i travnjaka ✅ Set od 6 komada — kompletno osvetljenje staze ili leja bez doplate ✅ 8–10 sati rada — solarna baterija puni se danju, automatski se uključuje noću ✅ Minimalistički dizajn — lako se uklapa u svaki tip ekst","3990.00 RSD"
"10397629219115","Solarna LED Lampa LUX-9","https://www.kupilica.com/products/solarna-led-lampa-lux-9","https://cdn.shopify.com/s/files/1/0843/5738/2443/files/solarna-led-lampa-lux-9-pregled.jpg?v=1779627407","IP67 solarna lampa sa 800mAh baterijom — 13 sati svetlosti po jednom solarnom punjenju ✅ IP67 vodootpornost — potpuna zaštita od kiše i potapanja, jača od standardnog IP65 ✅ 800mAh baterija — do 13 sati svetlosti na jednom punjenju (4–6 sati direktnog sunca) ✅ Podesiva visina — teleskopski nastavak ","2490.00 RSD"
"10397618045227","Solarna LED Lopta Dekorativna Bašta i Dvorište","https://www.kupilica.com/products/solarna-led-lopta-dekorativna","https://cdn.shopify.com/s/files/1/0843/5738/2443/files/solarna-led-lopta-dekorativna-pregled_1183449c-e370-450f-b2a3-80581a1e34aa.jpg?v=1779627416","30 LED dioda u obliku sfere — dekorativna lopta koja se pali sama svake večeri ✅ Efekat napuknutog stakla — unikatna ABS sfera vizuelno imitira napuklo staklo sa toplim sjajem ✅ 30 LED dioda — toplo belo svetlo koje ne zasljepljuje, ali jasno osvetljava prostor oko sfere ✅ Automatski senzor dan/noć ","2190.00 RSD"
"10397644849451","Solarna LED Sijalica LUX-1822T","https://www.kupilica.com/products/solarna-led-sijalica-lux-1822t","https://cdn.shopify.com/s/files/1/0843/5738/2443/files/solarna-led-sijalica-lux-1822t-pregled.jpg?v=1779627434","Solarna LED sijalica sa dva načina punjenja — svetlost na svakom mestu bez utičnice ✅ Dvojno punjenje — solarni panel ili adapter (oba u paketu), radi svuda bez struje ✅ Više režima svetla — prilagodite jačinu i vrstu osvetljenja situaciji ✅ Kukica za kačenje — okačite na šator, granu, plafon radion","2090.00 RSD"
"10409510994219","Solarna rasveta za dvorište — set od 6 lampi","https://www.kupilica.com/products/solarna-rasveta-za-dvoriste-set-od-6-lampi","https://cdn.shopify.com/s/files/1/0843/5738/2443/files/solarna-rasveta-za-dvoriste-set-od-6-lampi-1.jpg?v=1780472082","Set od 6 solarnih baštenskih lampi koje noću osvetljavaju cele staze ✅ Šest lampi u jednom paketu — pokrivenost cele staze, ne morate kupovati dodatne ✅ Automatsko paljenje uveče — senzor sumraka uključi sve istovremeno ✅ Bez sprovedene struje — zabodete u zemlju, ne traži električara ✅ Punjenje dan","2500.00 RSD"
"10396874473771","Solarna Rotirajuća Wi – Fi Kamera- Q6","https://www.kupilica.com/products/solarna-rotirajuca-wi-fi-kamera","https://cdn.shopify.com/s/files/1/0843/5738/2443/files/solarna-rotirajuca-wi-fi-kamera-pregled_1ee869da-10ac-48f9-b82e-fe8949d12167.jpg?v=1779628202","Solarno napajanje, Wi-Fi prenos — bez struje, bez montažera ✅ Solarni panel — 3W panel puni bateriju tokom dana, kamera radi noću ✅ Wi-Fi konekcija — prenos slike na mobilnu aplikaciju bez mrežnog kabla ✅ 1920×1080 (Full HD) rezolucija — jasna slika i tokom noći zahvaljujući IR diodama ✅ Bežična mon","6490.00 RSD"
"10409511026987","Solarna zidna lampa sa senzorom pokreta — set od 2","https://www.kupilica.com/products/solarna-zidna-lampa-sa-senzorom-pokreta-set-od-2","https://cdn.shopify.com/s/files/1/0843/5738/2443/files/solarna-zidna-lampa-sa-senzorom-pokreta-set-od-2-1.png?v=1780472092","Solarna zidna lampa — dva komada sa senzorom pokreta i IP65 zaštitom ✅ Set od dva komada — pokrije dve strane kuće ili dva ulaza ✅ Senzor pokreta + senzor sumraka — pali se sama uveče, jača pri kretanju ✅ IP65 vodootporna — kiša, sneg i prašina ne smetaju, radi celu godinu ✅ Svetlosno vreme 6–12 sat","1490.00 RSD"
"9587000901931","Solarne lampe za baštu 10 kom","https://www.kupilica.com/products/solarne-lampe-za-bastu-10-kom","https://cdn.shopify.com/s/files/1/0843/5738/2443/files/main-image-1_e969cea5-2622-4009-b533-ab1a07b6b5b2.jpg?v=1721210692","Set od 10 komada solarnih LED baštenskih lampi su idealne za dvorišta, bašte, terase, kamenjare, saksije. Lampe su izradjene od nerdjajućeg čelika i svaka u sebi ima po jednu LED lampicu. Veoma su otporne na sve vremenske uslove. Svaka LED lampa sadrži punjivu bateriju koja se u toku dana puni solar","1999.00 RSD"
"10409511092523","Solarne lampice za baštu — efekat svitaca na vetru","https://www.kupilica.com/products/solarne-lampice-za-bastu-efekat-svitaca-na-vetru","https://cdn.shopify.com/s/files/1/0843/5738/2443/files/solarne-lampice-za-bastu-efekat-svitaca-na-vetru-1.jpg?v=1780472107","Solarne lampice za baštu — fleksibilne žice koje lepršaju na vetru kao sviće ✅ Dekorativna lančasta rasveta — mekane grane lepršaju, izgledaju kao jato svitaca ✅ Dva režima osvetljenja — topla bela boja i treperavi (firefly) efekat ✅ Vodootporne — radi i po kiši, izdržavaju vremenske uslove ✅ Automa","1499.00 RSD"
"10397681484075","Solarne LED Baštenske Lampe LUX-5 – Set od 6 Lampi","https://www.kupilica.com/products/solarne-led-bastenske-lampe-lux-5","https://cdn.shopify.com/s/files/1/0843/5738/2443/files/solarne-led-bastenske-lampe-lux-pregled.jpg?v=1779627448","Set od 6 solarnih lampi sa orijentalnim uzorkom — noćna igra svetla i senki u bašti ✅ Orijentalni uzorak — perforirana površina baca dekorativne senke na okolne zidove i tlo ✅ IP65 vodootpornost — traje napolju u svim vremenskim uslovima ✅ Romantičan ambijent — toplo svetlo kroz orijentalne motive s","4890.00 RSD"
"10397632299307","Solarne LED Lampe LUX-01 – Set od 6 Lampi","https://www.kupilica.com/products/solarne-led-lampe-lux-01","https://cdn.shopify.com/s/files/1/0843/5738/2443/files/solarne-led-lampe-lux-01-pregled.jpg?v=1779627476","Set od 6 solarnih lampi sa motivom listova — naturalistički efekat koji se uklapa u svaki zelenilu ✅ Motiv listova — dekorativni dizajn koji vizuelno dopunjuje baštu, travnjak i cvetne lejeve ✅ Set od 6 komada — kompletno osvetljenje staze ili gredice bez doplate ✅ IP44 vodootpornost — otporna na ki","4990.00 RSD"
"10397652648235","Solarne LED Lampe LUX-02","https://www.kupilica.com/products/solarne-led-lampe-lux-02","https://cdn.shopify.com/s/files/1/0843/5738/2443/files/solarne-led-lampe-lux-02-pregled.jpg?v=1779627493","Set od 6 solarnih lampi ojačanog ABS+PVC kućišta — 8 sati automatskog noćnog osvetljenja ✅ Ojačani ABS+PVC materijal — čvršće kućište od standardnog ABS, otporno na udarce ✅ 8 sati rada — baterija se puni tokom dana, automatski radi noću ✅ IP65 vodootpornost — radi u kiši, snegu i prašini bez zaštit","5390.00 RSD"
