"id","title","description","link","image_link","additional_image_link","availability","condition","price","sale_price","brand","gtin","identifier_exists","mpn","google_product_category","product_type","shipping","item_group_id","product_highlights","custom_label_0","custom_label_1","custom_label_2","custom_label_3","custom_label_4","color","material","size","age_group","gender"
"7887206678711","Magično svetleće ćebe - Poboljšava san","Želite li da vaše dete ima umirujući osećaj sigurnosti dok spava? Predstavljamo vam čarobno ćebe koje svetli u mraku! Napravljeno od izuzetno mekanog i prijatnog materijala , ovo ćebe pruža toplinu i udobnost tokom cele noći. Deca ga obožavaju! Njegova jedinstvena tehnologija omogućava mu da upija svetlost iz okruženja, bilo da je u pitanju sunčeva svetlost ili kućno osvetljenje, i da je emituje u mraku , stvarajući umirujuću i magičnu atmosferu . Ovo ćebe je potpuno bezbedno za decu i odrasle i idealno je za: ✔️Lakše snalaženje u mraku. ✔️Stvaranje opuštajuće atmosfere za spavanje. ✔️Pružanje osećaja sigurnosti deci koja se plaše mraka. ✔️Čitanje pre spavanja uz blago svetlo. ✔️ Dekoraciju dečije sobe. UPUTSTVO ZA UPOTREBU: Izložite ćebe prirodnom ili veštačkom svetlu 15-30 minuta. Ugasite svetlo i uživajte u sjaju zvezda i meseca. Materijal: 100% čisti pamuk KUPOVINA BEZ RIZIKA – PLAĆANJE POUZEĆEM Obezbedite sebi i svojoj porodici miran i ugodan san uz ovo čarobno ćebe! Brza dostava i 14 dana garancije. ✓ Poručite sada i uživajte u toplini ćebenceta! (na stanju je još samo nekoliko komada)","https://www.poklonizadecu.com/products/magicno-svetlece-cebe","https://cdn.shopify.com/s/files/1/0622/6382/0471/files/2_c7440bc9-6ec3-4e69-aa0d-bf742c01d460.png?v=1734802167","https://cdn.shopify.com/s/files/1/0622/6382/0471/files/4_c3bc5daa-b0b5-42b3-ade3-b530e62b4121.png?v=1734855502,https://cdn.shopify.com/s/files/1/0622/6382/0471/files/1_5a9114a2-448b-4b73-a807-20a55e93fd7e.png?v=1734802011,https://cdn.shopify.com/s/files/1/0622/6382/0471/files/3_d3246d5f-b515-40af-82aa-3ada27c36959.png?v=1734802008","in stock","new","3980.00 RSD","1499.00 RSD","Mangoshop.rs","","no","00408-1","632","","RS::Standard:450 RSD","","","","","","","","","","","",""
"8405242773687","Magnetni set štapića -Za male graditelje 103 dela","Otkrij malog genija u svom detetu s magnetnim štapićima! Zamisli kako tvoje dete stvara neverovatne 3D figure, satove, životinje, pa čak i cele gradove, sve to koristeći samo svoju maštu i ovaj set magnetnih štapića. Ovo nije samo igračka, već pravi alat za razvoj dečje kreativnosti i inteligencije! Beskrajne mogućnosti za razvoj deteta ❤️ Gradi i stvaraj : Od jednostavnih oblika do složenih konstrukcija, granice postoje samo u mašti. ❤️ Uči i zabavi se : Dok se deca igraju, oni uče o bojama, oblicima, magnetizmu i prostornoj percepciji. ❤️ Razvija veštine : Poboljšava finu motoriku, koordinaciju oko-ruka i logičko razmišljanje. Zašto su magnetni štapići posebni? ✔️ Visok kvalitet : Izrađeni od sigurnih i izdržljivih materijala. ✔️ Šareni i zabavni : Širok izbor boja podstiče maštu i kreativnost. ✔️ Edukatvni: Sadrže elemente STEM učenja (nauka, tehnologija, inženjerstvo, matematika) Najbolji način da provedite više vremena sa vašim mališanima * Kvalitetno vreme : Provedite nezaboravne trenutke igrajući se sa svojim detetom. *Mirni trenuci : Dok se dete igra, ti možeš odahnuti i opustiti se. *Investicija u budućnost :Podržite razvoj svog deteta i osigurajte mu sate zabave i učenja. Set se sastoji od 6 boja podeljenih na toplu (žuta, narandžasta i crvena) i hladnu boju (zelena, plava i ljubičasta). Topla boja (severni pol) privlači hladnu boju (južni pol). → Set od 103 dela. → Za decu od 3 do 103 godine → Materijal : Metal,akrilonitril butadien stiren← KUPOVINA BEZ RIZIKA – PLAĆANJE POUZEĆEM Poručite magnetne štapiće već danas! Brza dostava i 30 dana garancije. ✓ 🔥Ograničeno vreme akcije se uskoro završava. Požuri i uštedi 2010 dinara - klikom na dugme PORUČIVANJE!","https://www.poklonizadecu.com/products/magnetni-set-stapica-za-male-graditelje-103-dela","https://cdn.shopify.com/s/files/1/0622/6382/0471/products/5_1a4abdfd-88db-4ce5-9748-58f3bcb2a565.png?v=1701424390","https://cdn.shopify.com/s/files/1/0622/6382/0471/files/B2_b5da37f6-61f2-460b-8fe8-604131820504.png?v=1763629851,https://cdn.shopify.com/s/files/1/0622/6382/0471/products/4_201e486a-7441-42a1-9c4d-f9505b909c98.png?v=1763629851,https://cdn.shopify.com/s/files/1/0622/6382/0471/files/B3_bd343e65-fae4-4b3b-8ab2-e259abe49beb.png?v=1763629851","in stock","new","4000.00 RSD","2790.00 RSD","Kupilica","","no","0019-1","632","","RS::Standard:450 RSD","","","","","","","","","","","",""
"7436969836727","Magnetni set štapića -Za male graditelje 64 dela","Otkrij malog genija u svom detetu s magnetnim štapićima! Zamisli kako tvoje dete stvara neverovatne 3D figure, satove, životinje, pa čak i cele gradove, sve to koristeći samo svoju maštu i ovaj set magnetnih štapića. Ovo nije samo igračka, već pravi alat za razvoj dečje kreativnosti i inteligencije! Beskrajne mogućnosti za razvoj deteta ❤️ Gradi i stvaraj : Od jednostavnih oblika do složenih konstrukcija, granice postoje samo u mašti. ❤️ Uči i zabavi se : Dok se deca igraju, oni uče o bojama, oblicima, magnetizmu i prostornoj percepciji. ❤️ Razvija veštine : Poboljšava finu motoriku, koordinaciju oko-ruka i logičko razmišljanje. Zašto su magnetni štapići posebni? ✔️ Visok kvalitet : Izrađeni od sigurnih i izdržljivih materijala. ✔️ Šareni i zabavni : Širok izbor boja podstiče maštu i kreativnost. ✔️ Edukatvni: Sadrže elemente STEM učenja (nauka, tehnologija, inženjerstvo, matematika) Najbolji način da provedite više vremena sa vašim mališanima * Kvalitetno vreme : Provedite nezaboravne trenutke igrajući se sa svojim detetom. *Mirni trenuci : Dok se dete igra, ti možeš odahnuti i opustiti se. *Investicija u budućnost :Podržite razvoj svog deteta i osigurajte mu sate zabave i učenja. Set se sastoji od 6 boja podeljenih na toplu (žuta, narandžasta i crvena) i hladnu boju (zelena, plava i ljubičasta). Topla boja (severni pol) privlači hladnu boju (južni pol). → Set od 64 dela. → Za decu od 3 do 103 godine → Materijal : Metal,akrilonitril butadien stiren← KUPOVINA BEZ RIZIKA – PLAĆANJE POUZEĆEM Poručite magnetne štapiće već danas! Brza dostava i 30 dana garancije. ✓ 🔥Ograničeno vreme akcije se uskoro završava. Požuri i uštedi 2010 dinara - klikom na dugme PORUČIVANJE!","https://www.poklonizadecu.com/products/magnetni-set-stapica-i-kugli","https://cdn.shopify.com/s/files/1/0622/6382/0471/products/5_1a4abdfd-88db-4ce5-9748-58f3bcb2a565.png?v=1701424390","https://cdn.shopify.com/s/files/1/0622/6382/0471/files/B2_b5da37f6-61f2-460b-8fe8-604131820504.png?v=1763629851,https://cdn.shopify.com/s/files/1/0622/6382/0471/products/4_201e486a-7441-42a1-9c4d-f9505b909c98.png?v=1763629851,https://cdn.shopify.com/s/files/1/0622/6382/0471/files/B3_bd343e65-fae4-4b3b-8ab2-e259abe49beb.png?v=1763629851","in stock","new","4000.00 RSD","1990.00 RSD","Kupilica","","no","0019","632","","RS::Standard:450 RSD","","","","","","","","","","","",""
"7885771243703","Magnetni set za pecanje + Poklon","IGRAČKA ZA RAZVIJANJE KOORDINACIJE I MOTORIČKIH SPOSOBNOSTI! SET ZA PECANJE SADRŽI: 30 šarenih ribica i morskih stvorenja. ✓ 3 mreže hvataljke. ✓ Jedan veliki bazen. (60cm x 24cm) ✓ Pumpa za bazen. ✓ PLUS POKLON TRI PECALJKE! TAKO DA NIKAD NE MOŽE DA DOSADI! SVAKO SE RADO SETI DANA KADA SE IGRAO PECANJA! → Ribice su velike i kvalitetne! ← → Za decu od 2 - 10 godina! ← → Svi delovi su napravljeni od izdržljivog materijala. ← → Ribice je moguće staviti i u kadu dok se dete kupa! ← PRUŽITE VAŠEM DETETU DOŽIVLJAJ KOJI ĆE DA PAMTI! KUPOVINA BEZ RIZIKA - PLAĆANJE POUZEĆEM 30 dana garancije - lak i brz povraćaj! Post-express pošiljka. (1-2 dana) Cena dostave je 290 dinara. PORUČI SET ZA PECANJE NA AKCIJI! (AKCIJA TRAJE SAMO ZA PRVIH 30 PORUDŽBINA)","https://www.poklonizadecu.com/products/set-za-pecanje-poklon","https://cdn.shopify.com/s/files/1/0622/6382/0471/files/Savrsenozapoklon_6.png?v=1729890781","https://cdn.shopify.com/s/files/1/0622/6382/0471/files/Savrsenozapoklon_2.png?v=1729890781,https://cdn.shopify.com/s/files/1/0622/6382/0471/files/Savrsenozapoklon_3.png?v=1729890781,https://cdn.shopify.com/s/files/1/0622/6382/0471/files/Savrsenozapoklon_4_4cf9854e-2aa8-4257-ad55-999c5b4a21d5.png?v=1729890781","out of stock","new","5990.00 RSD","2690.00 RSD","Poklon Igracke","","no","0020","632","Toy Jacks","RS::Standard:450 RSD","","","","","","","","","","","",""
"7436969869495","Meda skrivalica plišana igračka za decu","Meda skrivalica – najbolji prijatelj za vaše dete Zamisli osmeh na licu tvog deteta dok se igra s našim pametnim medom ! Ovaj interaktivni plišani drug ne samo da će zabaviti tvoje mališane, već će im pomoći i u razvoju. Izaziva smeh i radost kod vašeg deteta ❤️Plišani meda voli da podigne ćebence i sakrije se iza njega, tako će i deca vežbati skrivanje zajedno sa njim! ❤️Meda obožava da priča sa mališanima , a čuli smo da i mališani rado pričaju sa njim! ❤️Meda ume da izgovori čak šest različitih fraza koje su tu da zabave klince dok se igraju sa njim! Podstiče zdrav razvoj mozga i odlično raspoloženje ✔️ Razvoj motorike : Igra s medom podstiče razvoj fine motorike i koordinacije oko-ruka. ✔️ Socijalne veštine : Interakcija s medom podstiče razvoj govora i komunikacijskih veština. ✔️ Emocionalni razvoj : Mekani i umirujući zagrljaji medvjedića pomažu u stvaranju sigurnog okruženja. → Odličan za decu svih uzrasta ← → Materijal : Pliš, pamuk, ABS ← → Dimenzija : 30cm ← → Upotreba: Baterije: 3 x AA(ne dolaze u pakovanju) ← → Paket sadrži: 1 x Plišani meda koji govori ← Lak za čišćenje sa dugotrajnim dizajnom Znamo da mališani umeju da budu nepažljivi i da se igračke često zaprljaju. Ovog medu možete očistiti mokrom krpom ili vlažnom maramicom. Savršen poklon za nove roditelje i mališane KUPOVINA BEZ RIZIKA – PLAĆANJE POUZEĆEM Poručite medu skrivalicu već danas! Brza dostava i 30 dana garancije. ✓ 🔥Ograničeno vreme akcije se uskoro završava. Požuri i uštedi 1510 dinara - klikom na dugme PORUČIVANJE!","https://www.poklonizadecu.com/products/meda-skrivalica","https://cdn.shopify.com/s/files/1/0622/6382/0471/products/5_105f2b54-d26f-4728-85b4-75a4bc1a4794.png?v=1701424400","https://cdn.shopify.com/s/files/1/0622/6382/0471/products/4_5c3295ce-3575-41c9-a09a-483eed9130ca.png?v=1701424400,https://cdn.shopify.com/s/files/1/0622/6382/0471/products/6_f02ebbb9-c4e3-4500-a5ac-6ca02f56ef2b.png?v=1701424400,https://cdn.shopify.com/s/files/1/0622/6382/0471/products/7_9a179684-da3b-413d-92e3-76eb7e13656f.png?v=1701424400","in stock","new","3500.00 RSD","1899.00 RSD","Kupilica","","no","0021","1253","","RS::Standard:450 RSD","","","","","","","","","","","",""
"7884431098039","Mekano ćebence - pidžama za bebe","Noć bez buđenja: ćebence za spavanje za miran san novorođenčeta Vaša beba se često budi noću? Stalno ležete i budite se umorni? Istraživanja su pokazala da bebe, zbog adaptacije na spoljašnji svet, tokom prvih meseci imaju neredovan san. Mi Vam nudimo rešenje! Posebno dizajnirana, naša vreća za spavanje podsetiće bebu na boravak u stomaku i ona će poboljšati san i za do 30%! Izuzetno toplo i prijatno Učinite da Vašem detetu bude udobno i toplo u ovim zimskim mesecima! Izrađen od pamuka , ovaj proizvod učiniće da se Vaše dete oseća prijatno dok spava. Odličan kvalitet U izradi ovog proizvoda korišćeni su izuzetno kvalitetni i izdržljivi materijali , tako da će i nakon bezbroj pranja sačuvati svoj prvobitni izgled . Dete će moći slobodno da pomera svoje ruke Niko od nas ne voli kada ga nešto guši i pritiska dok spava. Budući da naš proizvod nema rukave, Vaša beba će moći neometano da pomera ruke , a da pritom ostane ušuškana . Unikatan poklon! Kada se beba rodi, svi želimo nešto da joj poklonimo . Uvek postoji dilema šta kupiti, a da roditelji već nisu obezbedili. Budući da je naš proizvod nov na tržištu , verovatno ćete biti jedini koji će pokloniti tako nešto ! Tehničke karakteristike proizvoda: Materijal : Pamuk i poliester Boje : roze i plava Uzrast : do 3 meseca 🔥 Ograničeno vreme akcije se uskoro završava. Požuri i uštedi 1110 dinara!","https://www.poklonizadecu.com/products/vreca-za-spavanje-pidzama-za-bebe","https://cdn.shopify.com/s/files/1/0622/6382/0471/files/vreca-za-spavanje-pidzama-za-bebe-rs-mangoshop-com-1.jpg?v=1729630713","https://cdn.shopify.com/s/files/1/0622/6382/0471/files/vreca-za-spavanje-pidzama-za-bebe-rs-mangoshop-com-3.jpg?v=1729630713,https://cdn.shopify.com/s/files/1/0622/6382/0471/files/vreca-za-spavanje-pidzama-za-bebe-rs-mangoshop-com-4.jpg?v=1729630713,https://cdn.shopify.com/s/files/1/0622/6382/0471/files/vreca-za-spavanje-pidzama-za-bebe-rs-mangoshop-com-5.jpg?v=1729630713","in stock","new","2800.00 RSD","1790.00 RSD","poklonizadecu.com","","no","00424-1","537","","RS::Standard:450 RSD","","","","","","","","","","","",""
"7908372447415","Minecraft magnetne magične kocke","MAGNETNE KOCKE ZA BESKRAJNU ZABAVU! Stvarajte, učite i igrajte se! ✓ Razvijajte maštu i motoriku kroz igru. ✓ Savršeno za decu i odrasle! ✓ KREATIVNA ZABAVA KOJA POVEZUJE Magnetne kocke koje inspirišu – Jednostavne za slaganje, beskrajne mogućnosti! – Siguran materijal i jak magnet – Edukativne i zabavne u isto vreme! MAGNETNE KOCKE SADRŽE: Set od XX komada kocki u raznim bojama i oblicima. ✓ Jaku kutiju za čuvanje i nošenje. ✓ Ilustrovano uputstvo za inspiraciju. ✓ EDUKATIVNO I ZABAVNO ISKUSTVO Idealan poklon za svako dete! Pomaže u razvoju logike, kreativnosti i koordinacije. Prilagođene svim uzrastima. Kupovina bez rizika 🛡️ 14 dana garancije 💰 Plaćanje pouzećem 🚚 Brza dostava na kućnu adresu Zalihe su ograničene. Naručite Minecraft magnetne kocke i poklonite detetu igračku koja donosi pravu zabavu!","https://www.poklonizadecu.com/products/magic-cube","https://cdn.shopify.com/s/files/1/0622/6382/0471/files/minecraft-cubes-sve.webp?v=1763812321","https://cdn.shopify.com/s/files/1/0622/6382/0471/files/KLOCKI-MAGNETYCZNY-MINECRAFT-ZABAWKA-HARVEST-FARM-KLOCKI-218SZT.jpg?v=1763812321,https://cdn.shopify.com/s/files/1/0622/6382/0471/files/minecraft-cubes-110-2.webp?v=1763812321,https://cdn.shopify.com/s/files/1/0622/6382/0471/files/Nenaslovljeni_dizajn_51_9fd5d382-261f-4a53-a8b9-f569a5366ab5.png?v=1763812321","in stock","new","3880.00 RSD","2490.00 RSD","Pokloni za decu","","no","Creative World-53","632","","RS::Standard:450 RSD","","","","","","","","","","","",""
"7887204581559","Mini dron","Idealan za decu i odrasle koji traže uzbudljivu igračku koja će testirati i unaprediti njihove veštine letenja! Pripremite se za uzbuđenje koje će Vas vinuti u visine! Naš mini dron nudi iskustvo letenja koju može kontrolisati čak i početnik, donoseći nebo u Vaš dnevni boravak. Naš mini dron koristi naprednu tehnologiju da stvori iskustvo letenja koje je lako i zabavno. Jednostavan za upravljanje pokretima ruke, ovaj dron je savršen za obuku mladih pilota i za one koji tek započinju svoju avanturu sa dronovima. Sa ugrađenim LED svetlima, naš mini dron je idealan za noćne letove, pružajući svetlosni šou koji će oduševiti sve uzraste. Ne samo da je naš mini dron zabavan, već pomaže u razvoju koordinacije, preciznosti i motoričkih sposobnosti. Sati zabave i učenja su zagarantovani! Specifikacije: Uzrast: 8+ Dimenzije: 20 x 20 x 8.5 cm Materijal: Žuta/Šarena plastika Svetlo: 32 LED svetla Vreme letenja: 7 minuta Vreme punjenja: 60 minuta Domet: Do 80m Baterija: 3.7V 500mAh, punjenje preko USB-a","https://www.poklonizadecu.com/products/mini-dron","https://cdn.shopify.com/s/files/1/0622/6382/0471/files/s1_59f49316-76f5-4c72-8172-955bbaadd0c8.png?v=1730289756","https://cdn.shopify.com/s/files/1/0622/6382/0471/files/s2_dea71d41-9fdf-4b45-b44c-1c58c602913b.png?v=1730289756,https://cdn.shopify.com/s/files/1/0622/6382/0471/files/s3_df24f577-5a5b-496e-9a10-9753f066f28b.png?v=1730289756,https://cdn.shopify.com/s/files/1/0622/6382/0471/files/s4_4833d353-c22b-459a-b231-acf3e4069f67.png?v=1730289756","out of stock","new","3899.00 RSD","2399.00 RSD","Sve za decu","","no","005056","632","","RS::Standard:450 RSD","","","","","","","","","","","",""
"7884413698231","Mini projektor za decu sa šarenim motivima","✨ Magične priče pred spavanje ✨ Pomoću ovog čarobnog uređaja, Vaši mališani će moći ne samo da slušaju već i da vide avanture o kojima im pričate. Živopisne slike životinja koje se projektuju na zid ili plafon pretvaraju obično čitanje u nezaboravnu vizuelnu poslasticu, čineći večernje rutine uzbudljivijim i nezaboravnim! 🐇 Mašta na delu 🌈 Za razliku od crtanih filmova, naš projektor podstiče kreativnost i maštu! Dok Vaše dete gleda statične slike životinja, podstaknuto je da zamišlja svoje priče, pune čuda i avantura. Ovaj balans između vizualnih podsticaja i prostora za maštu čini ovaj projektor savršenim alatom za razvoj kreativnog mišljenja. 🎤 Mali pripovedači 📚 Podstaknite decu da budu pripovedači! Nakon što se upoznaju sa slikama koje projektor prikazuje, deci se pruža šansa da sami ispričaju svoje verzije priča. Ovo ne samo da razvija njihovu maštu, već ih i uči veštinama pripovedanja i izražavanja. 🎥 Lako za upotrebu 🌟 Jednostavnost na prvom mestu! Samo umetnite disk sa slikama u projektor, uključite ga i započnite čaroliju. Prstom okrenite disk da se slike menjaju dok pripovedate svoju priču. Lakoća upotrebe čini ovaj projektor idealnim i za roditelje i za decu. 📖 Slikovnica novog doba 📘 U susret novoj eri pričanja priča! Ovaj projektor je kao moderna slikovnica koja oživljava priče na zidovima vaše sobe. Njegove živopisne slike i lakoća korišćenja otvaraju vrata novom, interaktivnom načinu učenja i zabave.","https://www.poklonizadecu.com/products/mini-projektor-za-decu-sa-sarenim-motivima","https://cdn.shopify.com/s/files/1/0622/6382/0471/files/s10_235fa2ea-41c5-41ed-aa5b-b2b85d7c9097.png?v=1729629549","https://cdn.shopify.com/s/files/1/0622/6382/0471/files/s1_916e13e0-338f-4369-99fa-8eb25719b480.png?v=1729629549,https://cdn.shopify.com/s/files/1/0622/6382/0471/files/s2_16b62419-0324-4f9a-afaa-10c234387dd0.png?v=1729629549,https://cdn.shopify.com/s/files/1/0622/6382/0471/files/s3_8f8599ce-87a7-4a2a-87c7-31425e46455e.png?v=1729629549","in stock","new","2350.00 RSD","1299.00 RSD","Sve za decu","","no","005100","632","","RS::Standard:450 RSD","","","","","","","","","","","",""
"7864158552247","MINI STONI FUDBAL","NEKA NAJBOLJI POBEDI! Vuk je oduvek bio najveći ljubitelj fudbala u svojoj porodici. Kada je dobio igračku Stoni Fudbal, oči su mu zasijale kao reflektori na stadionu. Mama i tata su se osmehnuli, znajući da će ovo biti nova porodična avantura. ""Neka najbolji pobedi!"" uzviknuo je, postavljajući igračku na sred dnevne sobe. Objasnio je pravila i organizovao mali turnir. Svi su se smestili oko stola, pripremajući se da brane svoje golove. Čak i deka i baka su se brzo pridružili igri, pokazujući iznenađujuće dobre reflekse. Soba se brzo ispunila smehom i navijanjem. Svaki gol je bio propraćen uzvicima i tapšanjima. Vuk i njegov mlađi brat Todor pokazali su izuzetnu veštinu, braneći svoje golove sa lakoćom i spretnošću pravih golmana. Čak i kad bi neko primio gol, osmesi se nisu skidali sa lica, jer je zabava bila važnija od pobede. Kako su poeni bili zabeleženi na tabli, uzbuđenje je raslo. Ali pravi pobednici večeri nisu bili oni sa najviše poena, već cela porodica zbog dobre i pozitivne energije koju su širili. Roditelji su zaboravili na telefone, deca na televizore i tablete, svi su bili zauzeti ovom dinamičnom igračkom koja je postala centar večeri. Kako je veče odmicalo, Vuk je takođe shvatio da je igračka donela nešto više od obične zabave. Naučio je o sportskom duhu, timskom radu i tome kako je svaki član porodice važan u timu. Iako je na kraju turnira podigao ruke u znak pobede, znao je da je prava nagrada bila vreme provedeno sa najdražima.","https://www.poklonizadecu.com/products/mini-stoni-fudbal-za-decu","https://cdn.shopify.com/s/files/1/0622/6382/0471/files/71vdeYCoqjL._AC_SL1500.jpg?v=1726813562","","in stock","new","5699.00 RSD","2999.00 RSD","Happy Kidz","","no","0022","632","","RS::Standard:450 RSD","","","","","","","","","","","",""
"7903958565047","Montesory set drvenih šablona za crtanje 50 delova","50 KOMADA DRVENIH DIY ŠABLONA ZA CRTANJE Razvijajte maštu vaše dece! ✓ Kreativnost i zabava u svakom potezu. ✓ Idealan poklon za male umetnike. ✓ ŠTA DOBIJATE U OVO M NEVEROVATNOM SETU? 50 jedinstvena drvena šablona – životinje, biljke i još mnogo toga! Čak 12 Flomastera , 12 Pastelnih bojica , olovku , gumicu i rezač ! Prazno blokče i Spisak ideja za CRTANJE ! Precizne oznake i oblici – lako i zabavno za korišćenje. Praktičan set alata – uključuje bojice i pribor za crtanje. Eko materijal – sigurno za decu, napravljeno od kvalitetnog drveta. KREATIVNOST U SVAKOM DANU Savršeno za podsticanje dečje mašte! Lako se koristi – čak i za najmlađe uzraste. Kompaktan i prenosiv – ponesite kreativnost gde god idete. ZAŠTO JE OVO PRAVI IZBOR? Razvija motoričke sposobnosti dece. Podstiče učenje kroz igru. Odličan način da provedete kvalitetno vreme sa vašim mališanima. KUPOVINA BEZ RIZIKA – PLAĆANJE POUZEĆEM Poručite Montesory Kocke već danas! Brza dostava i 30 dana garancije. ✓ Obradujte svoje mališane ovim neverovatnim setom za crtanje! Požurite, količine su ograničene! Kliknite na PORUČIVANJE i omogućite vašem detetu da stvara magiju bojama!","https://www.poklonizadecu.com/products/montesory-kocke-48-delova","https://cdn.shopify.com/s/files/1/0622/6382/0471/files/mF3gS7d2597fe964f49a89c7c32fff2111d88F.png?v=1733080787","https://cdn.shopify.com/s/files/1/0622/6382/0471/files/50_PCS.png?v=1733577309,https://cdn.shopify.com/s/files/1/0622/6382/0471/files/n5smSf11f12ad5e214b85b3d2885952884b57e.png?v=1733080787,https://cdn.shopify.com/s/files/1/0622/6382/0471/files/Bu5bS4af292485188425f987e1a712ece9fd6i.png?v=1733080787","out of stock","new","2500.00 RSD","1540.00 RSD","Pokloni za decu","","no","MONT-42","632","","RS::Standard:450 RSD","","","","","","","","","","","",""
"7885771833527","Muzička Kraba - Podstiče puzanje","SA OVOM IGRAČKOM IGRA ĆE TRAJATI SATIMA! - Garantovano izmamljuje osmeh. - - Ne može da dosadi. - - Savršena igračka za poklon! - KRABA - EDUKATIVNA IGRAČKA: Razvoj senzornih veština. ✓ Podstiče puzanje. ✓ Izbegava prepreke. ✓ Emituje umirujuće melodije. ✓ Zabava je zagarantovana! ✓ Savršen poklon za praznike. ✓ IGRAČKA ĆE DRŽATI PAŽNJU SATIMA! DECA ŠIROM SVETA SU POLUDELA ZA OVOM IGRAČKOM! Kvalitetna i izdržljiva igračka! Dimenzije krabe 22x12cm. Dolazi sa poklon kutijom. Radi na 3AA obične baterije . (nisu u setu) Za dečake i devojčice od 0 - 7 . - POUZDANA KUPOVINA - 30 dana povraćaj - lako i brzo! Post-express pošiljka. (1-2 dana) Cena dostave je 290 dinara. Požuri i poruči Muzičku Krabu na AKCIJI! (zalihe se brzo prodaju - samo 8 komada na stanju)","https://www.poklonizadecu.com/products/2u1-muzicka-kraba-igracka-za-decu","https://cdn.shopify.com/s/files/1/0622/6382/0471/files/A7_200x200_323ea864-83af-407a-8646-8f7a1538224c.png?v=1730334106","https://cdn.shopify.com/s/files/1/0622/6382/0471/files/A1_200x200_277af4ca-8120-41a1-8b04-1f1404a71cf7.png?v=1730334106,https://cdn.shopify.com/s/files/1/0622/6382/0471/files/A2_200x200_3dc673b1-7339-4da5-9f87-4d205dea6e88.png?v=1730334106,https://cdn.shopify.com/s/files/1/0622/6382/0471/files/A3_200x200_352b2b62-2622-427c-8db4-c4446032a4be.png?v=1730334106","in stock","new","3990.00 RSD","1890.00 RSD","Poklon Igracke","","no","0023","632","","RS::Standard:450 RSD","","","","","","","","","","","",""
