"id","title","description","link","image_link","additional_image_link","availability","condition","price","sale_price","brand","gtin","identifier_exists","mpn","google_product_category","product_type","shipping","item_group_id","product_highlights","custom_label_0","custom_label_1","custom_label_2","custom_label_3","custom_label_4","color","material","size","age_group","gender"
"7892584104119","Pačiji tobogan igračka za decu soba i dvorište","IGRAČKA KOJA DRŽI PAŽNJU - PAČIJI TOBOGAN Unesite radost i zabavu u svaki dan!✓ Gledajte kako vaša deca uživaju u igri.✓ Razvijajte kreativnost i motoričke veštine kroz igru.✓ NEODOLJIVA ZABAVA ZA DECU Pametni dizajn: Električna patka koja se sama penje po stepenicama - Automatski se vraća na početak nakon penjanja - Kvalitetni materijali: Izrađena od sigurnih i izdržljivih materijala - Svetleće i zvučne efekte koji dodatno privlače pažnju - Razv ija veštine: Pomaže u razvoju motoričkih veština i koordinacije - Podstiče radoznalost i kreativno razmišljanje - IGRAČKA ELEKTRIČNA PATKA SADRŽI: 9 x Električna patka za penjanje po stepenicama visokog kvaliteta ✓ 1 x Set plastičnih stepenica ✓ SIGURNOST I ZABAVA Jednostavna za montažu i korišćenje! Idealna za decu svih uzrasta. Savršena za poklon i svaku priliku. KUPOVINA BEZ RIZIKA - PLAĆANJE POUZEĆEM 15 dana garancije - lak i brz povraćaj! Bex-express pošiljka (1-2 dana) Cena dostave je 400 dinara. Osigurajte neprekidnu zabavu za svoje mališane sada! 🔥Ograničeno vreme akcije se uskoro završava. Požuri i uštedi 2010 dinara - klikom na dugme PORUČIVANJE!","https://www.poklonizadecu.com/products/paciji-tobogan","https://cdn.shopify.com/s/files/1/0622/6382/0471/files/Untitled_design_4.png?v=1763969977","https://cdn.shopify.com/s/files/1/0622/6382/0471/files/4_14a336f5-e21e-43b8-b1d3-ad641d53c7bf.png?v=1763969977,https://cdn.shopify.com/s/files/1/0622/6382/0471/files/3_4aef1d40-535e-4f27-8c46-ac05ddf99bf4.png?v=1763969977,https://cdn.shopify.com/s/files/1/0622/6382/0471/files/2_37f4fae5-10cd-4781-b7f6-42291d0d9413.png?v=1763969977","in stock","new","3560.00 RSD","1550.00 RSD","Kupilica","","no","0043","1253","","RS::Standard:450 RSD","","","","","","","","","","","",""
"7884427985079","Raspevane stepenice","Pokrenite maštu Vašeg mališana sa našim raspevanim detektivskim stepenicama! Ova uzbudljiva igračka ne samo da izaziva oduševljenje sa svakim korakom na koji se popne njen veseli detektiv, već i pruža spektakl svetlosnih efekata i melodija koje će dodatno obogatiti igru i podstaknuti razvoj Vašeg deteta. Nakon uspešnog penjanja, detektivi će se hrabro spustiti niz tobogan, podstičući maštu Vašeg deteta da stvara nove priče i avanture. Zbog svoje praktičnosti, igračka se lako montira i idealna je za igru kako u zatvorenom prostoru, tako i na otvorenom. Ne propustite priliku da učinite svaku proslavu posebnom - bilo da je u pitanju rođendan ili neka druga svečanost, Raspevane detektivske stepenice su savršen poklon koji će svakom detetu doneti radost i puno smeha. Specifikacije: Uzrast: 3+ Materijal: Eko Plastika Dimenzije: Oko 25 x 6 x 17 cm","https://www.poklonizadecu.com/products/raspevane-detektivske-stepenice","https://cdn.shopify.com/s/files/1/0622/6382/0471/files/download.png?v=1729630417","https://cdn.shopify.com/s/files/1/0622/6382/0471/files/download_1_367db5f7-6af2-462f-9e97-64975012aeab.png?v=1729630417,https://cdn.shopify.com/s/files/1/0622/6382/0471/files/download_2.png?v=1729630417","out of stock","new","4199.00 RSD","2499.00 RSD","Sve za decu","","no","005033","632","","RS::Standard:450 RSD","","","","","","","","","","","",""
"7946839982263","Razigrana Svetleća Patkica","SA OVOM IGRAČKOM UŽIVANJE ĆE TRAJATI SATIMA! - Garantovano izmamljuje osmeh. - - Ne može da dosadi. - - Savršena igračka za poklon! - MUZIČKO SVETLEĆE PAČE: Razvoj senzornih veština. ✓ Podstiče puzanje. ✓ Emituje umirujuće melodije. ✓ Zabava je zagarantovana! ✓ IGRAČKA ĆE DRŽATI PAŽNJU SATIMA! DECA ŠIROM SVETA SU POLUDELA ZA OVOM IGRAČKOM! Kvalitetna i izdržljiva igračka! Dimenzije: 19x10x10cm. Dolazi sa poklon kutijom. Radi na 3AA obične baterije . (nisu u setu) Za dečake i devojčice od 0 do 8.","https://www.poklonizadecu.com/products/razigrana-svetleca-patkica","https://cdn.shopify.com/s/files/1/0622/6382/0471/files/24361350811.png?v=1738018633","https://cdn.shopify.com/s/files/1/0622/6382/0471/files/image_13.png?v=1738018633,https://cdn.shopify.com/s/files/1/0622/6382/0471/files/1_2b78ce67-62cc-4210-b6e6-2e75d8c92eec.png?v=1738018633,https://cdn.shopify.com/s/files/1/0622/6382/0471/files/5_44833453-b4e8-45c5-b93d-93ef08a87419.png?v=1738018633","in stock","new","2940.00 RSD","1790.00 RSD","Pokloni za decu","","no","00554","632","","RS::Standard:450 RSD","","","","","","","","","","","",""
"7436969935031","Retro konzola 10000 igrica+ 2 bežična džojstika","Da li Vam nedostaju dani kad ste bili bezbrižno dete i samo se igrali?Uz ovu konzolu sada možete da se podsetite tog detinjeg osećaja i da stvorite nove uspomene sa svojim najmlađima. S ovom izvanrednom konzolom možete uživati u preko 10.000 klasičnih igara (64GB) koje su obeležile generacije. Neke od igrica su Super Mario Bros, Lov na patke, Tenkići (battle city), Galaxian, F1 Race, Soccer, Conte Energy, 100 Meters atletika i druge. Sadržaj paketa: 1 x 64GB Memorijska kartica 2 x Džojstika 1 x Game Stick 1 x kabl za punjenje","https://www.poklonizadecu.com/products/retro-game-hdmi-stick-konzola-10000-igrica-2-bezicna-dzojstika","https://cdn.shopify.com/s/files/1/0622/6382/0471/files/TELEVIZNA-KONZOLA-PS1-20000-RETRO-HIER-2-HDMI-PADY-PRENOSNA-PRE-DIETA.jpg?v=1763624652","https://cdn.shopify.com/s/files/1/0622/6382/0471/files/Untitled_design_3.png?v=1763642723,https://cdn.shopify.com/s/files/1/0622/6382/0471/files/Untitled_design_2.png?v=1763642723,https://cdn.shopify.com/s/files/1/0622/6382/0471/products/6_d9883240-af51-42f9-bcdf-64a3c3473ac7.png?v=1763642723","in stock","new","4500.00 RSD","3500.00 RSD","Kupilica","","no","0029","632","","RS::Standard:450 RSD","","","","","","","","","","","",""
"7884427755703","Retro konzola sa igricama i pištoljem","Ponovno doživite detinjstvo uz našu retro konzolu! Da li se sećate vremena kada ste satima igrali 8-bitne igre sa svojim prijateljima? Sada možete da se vratite u ta vremena uz našu retro konzolu. Ova konzola nije samo deo Vaše prošlosti, već i idealna zabava za Vas i Vašu decu! Uživajte u klasicima iz sveta video igara! Ponovo ćete se susresti sa ikonama video igara kao što su Super Mario, Tenkići, Galaxian i mnoge druge. Najbolji deo? Sve ove igre su već instalirane na konzoli! Bez potrebe za dugim preuzimanjima ili traženjem igrica. U paketu dobijate 16 igrica koje možete odmah da isprobate. Naša konzola će Vas vratiti u vreme kada su igre bile jednostavne, a zabava zagarantovana! 👉 Razvija logičko zaključivanje kod dece Ove retro igre su savršene za razvoj dečijeg logičkog razmišljanja. Vaša deca će uživati u rešavanju zagonetki i savladavanju izazova, a istovremeno će izgraditi samopouzdanje u svom uspehu u igrama. 👉 Oživite magiju osamdesetih Konzole kao što je ova su bile pristupačne, jednostavne za korišćenje i pune zabavnih igara. Setite se vremena kada ste prvi put sreli Super Maria i kako je to oblikovalo Vašu ljubav prema igrama. 👉 Sve što Vam treba u jednom paketu Naš paket uključuje konzolu, 2 džojstika, pištolj za dodatnu zabavu, ugrađene igre, adapter za napajanje i AV priključak. Sve je spremno za igru čim otvorite kutiju. 👉 Ne brinite se ako ne pronađete odmah sve ulaze Ako vaš televizor nema potrebne ulaze, možete jednostavno rešiti ovaj problem nabavkom SCART činč adaptera. Ovaj adapter je pristupačan i lako dostupan, a pomoći će Vam da uspostavite potrebnu vezu bez suvišnih troškova. Laka i brza instalacija i povezivanje ✅ Povezivanje u par jednostavnih koraka Bez dugih postupaka ili komplikovanih uputstava, možete uživati u njegovim mogućnostima u trenutku kada ga povežete. ✅ Velika kompatibilnost Bez obzira da li je Vaš televizor stariji model ili najnoviji, ovaj uređaj će se bez problema povezati i omogućiti Vam da u potpunosti iskoristite njegove mogućnosti. ✅ Pištolj možda neće reagovati Važno je napomenuti da pištolj možda neće reagovati na svim televizorima. To ne znači da je neispravan, već da neki televizori ne podržavaju signale koje pištolj šalje. U slučaju da se to dogodi, nema brige, igre su i dalje tu za vas.","https://www.poklonizadecu.com/products/retro-konzola-sa-igricama-i-pistoljem","https://cdn.shopify.com/s/files/1/0622/6382/0471/files/retro-konzola-sa-igricama-i-pistoljem-pametna-kupovina-1.png?v=1729630394","https://cdn.shopify.com/s/files/1/0622/6382/0471/files/retro-konzola-sa-igricama-i-pistoljem-pametna-kupovina-2.jpg?v=1729630394,https://cdn.shopify.com/s/files/1/0622/6382/0471/files/retro-konzola-sa-igricama-i-pistoljem-pametna-kupovina-3.jpg?v=1729630394,https://cdn.shopify.com/s/files/1/0622/6382/0471/files/retro-konzola-sa-igricama-i-pistoljem-pametna-kupovina-4.jpg?v=1729630394","in stock","new","3290.00 RSD","1990.00 RSD","Pametna Kupovina","","no","00490","632","","RS::Standard:450 RSD","","","","","","","","","","","",""
"7884414681271","Roler koster za pačiće sa zvučnim efektima","Roler koster za pačiće dizajniran je ne samo da zabavi Vaše dete satima, već i da podstiče razvoj njihove mašte i motoričkih veština! 🎢🦆 Pružite Vašim mališanima nezaboravnu avanturu i zabavu sa ovom neverovatnom igračkom! 🌀 Automatske stepenice i uzbudljivi tobogan Opremljen automatskim stepenicama koje pačiće vode do vrha pre nego što se spuste niz tobogan, ovaj roler koster nudi zabavno iskustvo koje podstiče razumevanje uzroka i posledica, kao i fizike! 🎶 Veseli zvučni efekti Zvučni efekti roler kostera su pažljivo osmišljeni da oponašaju veselu atmosferu zabavnog parka, što će zasigurno razveseliti i zabaviti Vaše dete dok pačići uživaju u svojoj vožnji. 🐥 Simpatični mali pačići Svako pače ima svoje mesto u ovom toboganu i spremno je za uzbudljivu vožnju! 🌟 Vreme provedeno sa decom nema cenu! Provedite kvalitetno vreme sa decom. Verujte, oni će te trenutke pamtiti zauvek! Specifikacije proizvoda: Paket sadrži: 1x Roler koster set Materijal: Visokokvalitetna plastika Preporučeni uzrast: 3+ godina Zavrtite svet mašte i zabave sa ovim rolerkoster setom! Naručite odmah i gledajte kako Vaše dete postaje kreator svoje zabave i učenja!","https://www.poklonizadecu.com/products/roler-koster-za-pacice-sa-zvucnim-efektima","https://cdn.shopify.com/s/files/1/0622/6382/0471/files/A1_a4400334-1cbd-4edc-9f25-c5a9cf44f152.png?v=1729629603","https://cdn.shopify.com/s/files/1/0622/6382/0471/files/A3_e92837af-b260-48b4-bc4d-fb5ca681d4b2.png?v=1729629603,https://cdn.shopify.com/s/files/1/0622/6382/0471/files/A7_cf075506-1981-426c-ae0d-d629a830b408.png?v=1729629603,https://cdn.shopify.com/s/files/1/0622/6382/0471/files/A8_eaec7d49-805b-423e-b86f-69c797423a9c.png?v=1729629603","in stock","new","2460.00 RSD","1699.00 RSD","Sve za decu","","no","005096","632","","RS::Standard:450 RSD","","","","","","","","","","","",""
"7909934301367","Rotirajući Robot","ROTIRAJUĆI ROBOT KOJI SVETLI Unesite magiju u svoj dom! ✓ Zabava, svetlost i akcija u jednom. ✓ Oduševite decu i zadivite goste. ✓ FENOMENALAN ROBOT KOJI OŽIVLJAVA ✨ Robot koji se rotira i svetli – prava senzacija! ✨ LED svetla u duginim bojama – stvara čaroliju! ✨ Savršeno za igru, ples i smeh – ne staje ni na trenutak! ROTIRAJUĆI ROBOT SADRŽI: 1 x Robot sa rotirajućim funkcijama i LED svetlima ✓ 1 x USB kabl za punjenje (ili baterije po potrebi) ✓ 1 x Kutija za bezbedno pakovanje ✓ ZABAVA ZA SVE GENERACIJE Jednostavan za korišćenje – pritisnite dugme i pustite da vas oduševi! Izdržljiv i siguran za igru. Poklon koji donosi osmehe! KUPOVINA BEZ RIZIKA – PLAĆANJE POUZEĆEM Poručite rotirajućeg robota već danas! Brza dostava i 30 dana garancije. ✓ Naručite sada i pružite nezaboravnu radost!","https://www.poklonizadecu.com/products/rotirajuci-robot","https://cdn.shopify.com/s/files/1/0622/6382/0471/files/5_f5faeff0-6fcf-4503-8286-c8802cf4e9b3.png?v=1734769538","https://cdn.shopify.com/s/files/1/0622/6382/0471/files/4_76d93d2e-f11f-42a4-9f7b-3b626db3af60.png?v=1734769538,https://cdn.shopify.com/s/files/1/0622/6382/0471/files/3_87d75c0e-d946-4b2d-87cb-42b67b64b2fa.png?v=1734769538,https://cdn.shopify.com/s/files/1/0622/6382/0471/files/1_26e4f4ee-6a2c-4392-9f36-c038e8d42d78.png?v=1734769475","in stock","new","3450.00 RSD","990.00 RSD","Pokloni za decu","","no","RBT-1","632","","RS::Standard:450 RSD","","","","","","","","","","","",""
"8602849935543","Roze dečiji digitalni fotoaparat – mali svet velikih uspomena","Dečji digitalni fotoaparat u roze boji — prva kamera za male istraživače ✅ Uzrast 4–9 godina — proizvod prilagođen ovoj dobi ✅ Jedno dugme za snimanje — dete shvati za 30 sekundi, bez tvog objašnjavanja ✅ Snima sliku i video — kratki klipovi za društvene priče ✅ SD kartica za memoriju — slike se mogu prebaciti na laptop ili telefon ✅ Punjiva baterija + USB — punjenje preko bilo kog USB kabla Dečji digitalni fotoaparat roze je prva kamera tvog deteta — laka, izdrzljiva, sa jednim dugmetom za snimanje. Lagan digitalni fotoaparat sa fokusom na jednostavnost. Jedno dugme za snimanje, drugo za video, slike se čuvaju na SD kartici. Dolazi sa USB kablom i punjivom baterijom u kompletu. Ako tvoje dete već uzima tvoj telefon da slika sve oko sebe — vreme je za sopstvenu kameru. Sa ovim fotoaparatom dete pravi sopstvenu kolekciju uspomena, ti dobijaš telefon natrag, oboje srećni. ✨ Kako se ovaj fotoaparat koristi u stvarnom svetu Rođendanske žurke — dete slika prijatelje i tortu, posle možete štampati slike i napraviti album. Porodični izleti — dete ima sopstvenu kameru, ti ne moraš svaki put da daješ telefon. Slika ono što ono vidi važnim. Kreativni projekti za vrtić ili školu — fotografisanje cveća, insekata, kućnih ljubimaca. Slike idu u prezentaciju. Učenje strpljenja — fokusiranje, kadar, čekanje pravog momenta. Vežba za pažnju koja se prenosi i na druge aktivnosti. Putovanja i izleti — dete pravi vlastiti dnevnik puta kroz slike. Posle se lakše seća detalja. Poklon za rođendan ili praznik — pakovanje izgleda lepo, dolazi u kutiji, ne treba dodatno umotavati. Specifikacije Uzrast 4–9 godina Funkcije Slika + video Memorija SD kartica (nije uključena) Baterija Punjiva Li-ion Punjenje USB kabl (u kompletu) Boja roze Tema basic Garancija 12 meseci Sadržaj kutije 1× dečji fotoaparat 1× USB kabl za punjenje 1× kratko uputstvo Kome ovaj fotoaparat nije za Pošteno — ovo nije zamena za pravi fotoaparat. Slika ima rezoluciju za printanje na razglednici, ne za štampanje u A3. Ekran je mali i nije touch. Za tinejdžera koji već koristi telefon — ovo neće biti zanimljivo nakon nedelju dana. Pogodno je za uzrast 4–9 godina. Pogledajte i ostale igračke za decu ili poklone u kući u našoj ponudi. { ""@context"": ""https://schema.org"", ""@type"": ""BreadcrumbList"", ""itemListElement"": [ { ""@type"": ""ListItem"", ""position"": 1, ""name"": ""Početna"", ""item"": ""https://www.poklonizadecu.com/"" }, { ""@type"": ""ListItem"", ""position"": 2, ""name"": ""Fotoaparat za decu"", ""item"": ""https://www.poklonizadecu.com/collections/fotoaparat-za-decu/"" }, { ""@type"": ""ListItem"", ""position"": 3, ""name"": ""Roze dečiji digitalni fotoaparat — mali svet velikih uspomena"", ""item"": ""https://www.poklonizadecu.com/products/roze-deciji-digitalni-fotoaparat-mali-svet-velikih-uspomena/"" } ] }","https://www.poklonizadecu.com/products/roze-deciji-digitalni-fotoaparat-mali-svet-velikih-uspomena","https://cdn.shopify.com/s/files/1/0622/6382/0471/files/roze-deciji-digitalni-fotoaparat-mali-svet-velikih-uspomena-1.png?v=1781084300","https://cdn.shopify.com/s/files/1/0622/6382/0471/files/roze-deciji-digitalni-fotoaparat-mali-svet-velikih-uspomena-2.jpg?v=1781084300,https://cdn.shopify.com/s/files/1/0622/6382/0471/files/roze-deciji-digitalni-fotoaparat-mali-svet-velikih-uspomena-3.jpg?v=1781084300,https://cdn.shopify.com/s/files/1/0622/6382/0471/files/roze-deciji-digitalni-fotoaparat-mali-svet-velikih-uspomena-4.png?v=1781084300","in stock","new","3890.00 RSD","","PokloniZaDecu","","no","PKL-roze-deciji-digitalni-fotoaparat-mali-svet-velikih","1253","Igračke","RS::Standard:450 RSD","","","","","","","","","","","",""
"8602851606711","Roze dečiji fotoaparat sa mini stativom – nežan dizajn i puno kreativnosti","Dečji fotoaparat sa mini stativom — roze boja za stabilne snimke ✅ Uzrast 4–10 godina — proizvod prilagođen ovoj dobi ✅ Jedno dugme za snimanje — dete shvati za 30 sekundi, bez tvog objašnjavanja ✅ Snima sliku i video — kratki klipovi za društvene priče ✅ SD kartica za memoriju — slike se mogu prebaciti na laptop ili telefon ✅ Punjiva baterija + USB — punjenje preko bilo kog USB kabla Dečji fotoaparat sa stativom roze je prva kamera tvog deteta — laka, izdrzljiva, sa jednim dugmetom za snimanje. Fotoaparat dolazi sa malim stativom u kompletu. Dete može da postavi kameru na stol i slika sebe i prijatelje bez tresenja. Dolazi sa USB kablom i punjivom baterijom u kompletu. Ako tvoje dete već uzima tvoj telefon da slika sve oko sebe — vreme je za sopstvenu kameru. Sa ovim fotoaparatom dete pravi sopstvenu kolekciju uspomena, ti dobijaš telefon natrag, oboje srećni. ✨ Kako se ovaj fotoaparat koristi u stvarnom svetu Rođendanske žurke — dete slika prijatelje i tortu, posle možete štampati slike i napraviti album. Porodični izleti — dete ima sopstvenu kameru, ti ne moraš svaki put da daješ telefon. Slika ono što ono vidi važnim. Kreativni projekti za vrtić ili školu — fotografisanje cveća, insekata, kućnih ljubimaca. Slike idu u prezentaciju. Učenje strpljenja — fokusiranje, kadar, čekanje pravog momenta. Vežba za pažnju koja se prenosi i na druge aktivnosti. Putovanja i izleti — dete pravi vlastiti dnevnik puta kroz slike. Posle se lakše seća detalja. Poklon za rođendan ili praznik — pakovanje izgleda lepo, dolazi u kutiji, ne treba dodatno umotavati. Specifikacije Uzrast 4–10 godina Funkcije Slika + video Memorija SD kartica (nije uključena) Baterija Punjiva Li-ion Punjenje USB kabl (u kompletu) Boja roze Tema stativ Garancija 12 meseci Sadržaj kutije 1× dečji fotoaparat 1× USB kabl za punjenje 1× kratko uputstvo 1× mini stativ Kome ovaj fotoaparat nije za Pošteno — ovo nije zamena za pravi fotoaparat. Slika ima rezoluciju za printanje na razglednici, ne za štampanje u A3. Ekran je mali i nije touch. Za tinejdžera koji već koristi telefon — ovo neće biti zanimljivo nakon nedelju dana. Pogodno je za uzrast 4–10 godina. Pogledajte i ostale igračke za decu ili poklone u kući u našoj ponudi. { ""@context"": ""https://schema.org"", ""@type"": ""BreadcrumbList"", ""itemListElement"": [ { ""@type"": ""ListItem"", ""position"": 1, ""name"": ""Početna"", ""item"": ""https://www.poklonizadecu.com/"" }, { ""@type"": ""ListItem"", ""position"": 2, ""name"": ""Fotoaparat za decu"", ""item"": ""https://www.poklonizadecu.com/collections/fotoaparat-za-decu/"" }, { ""@type"": ""ListItem"", ""position"": 3, ""name"": ""Roze dečiji fotoaparat sa mini stativom — nežan dizajn i puno kreativnosti"", ""item"": ""https://www.poklonizadecu.com/products/roze-deciji-fotoaparat-sa-mini-stativom-nezan-dizajn-i-puno-/"" } ] }","https://www.poklonizadecu.com/products/roze-deciji-fotoaparat-sa-mini-stativom-nezan-dizajn-i-puno-kreativnosti","https://cdn.shopify.com/s/files/1/0622/6382/0471/files/roze-deciji-fotoaparat-sa-mini-stativom-nezan-dizajn-i-puno--1.png?v=1781084387","https://cdn.shopify.com/s/files/1/0622/6382/0471/files/roze-deciji-fotoaparat-sa-mini-stativom-nezan-dizajn-i-puno--2.png?v=1781084387,https://cdn.shopify.com/s/files/1/0622/6382/0471/files/roze-deciji-fotoaparat-sa-mini-stativom-nezan-dizajn-i-puno--3.png?v=1781084387,https://cdn.shopify.com/s/files/1/0622/6382/0471/files/roze-deciji-fotoaparat-sa-mini-stativom-nezan-dizajn-i-puno--4.png?v=1781084387","in stock","new","5090.00 RSD","","PokloniZaDecu","","no","PKL-roze-deciji-fotoaparat-sa-mini-stativom-nezan-diza","1253","Igračke","RS::Standard:450 RSD","","","","","","","","","","","",""
"8602853277879","Roze dečiji fotoaparat „Astronaut“ – Digitalna kamera za decu","Dečji fotoaparat Astronaut — kamera za male istraživače svemira ✅ Uzrast 3–8 godina — proizvod prilagođen ovoj dobi ✅ Jedno dugme za snimanje — dete shvati za 30 sekundi, bez tvog objašnjavanja ✅ Snima sliku i video — kratki klipovi za društvene priče ✅ SD kartica za memoriju — slike se mogu prebaciti na laptop ili telefon ✅ Punjiva baterija + USB — punjenje preko bilo kog USB kabla Dečji fotoaparat astronaut je prva kamera tvog deteta — laka, izdrzljiva, sa jednim dugmetom za snimanje. Fotoaparat sa astronaut dizajnom i zaštitnom maskom. Pokriva snimanje i video kroz prizmu svemirskih avantura. Dolazi sa USB kablom i punjivom baterijom u kompletu. Ako tvoje dete već uzima tvoj telefon da slika sve oko sebe — vreme je za sopstvenu kameru. Sa ovim fotoaparatom dete pravi sopstvenu kolekciju uspomena, ti dobijaš telefon natrag, oboje srećni. ✨ Kako se ovaj fotoaparat koristi u stvarnom svetu Rođendanske žurke — dete slika prijatelje i tortu, posle možete štampati slike i napraviti album. Porodični izleti — dete ima sopstvenu kameru, ti ne moraš svaki put da daješ telefon. Slika ono što ono vidi važnim. Kreativni projekti za vrtić ili školu — fotografisanje cveća, insekata, kućnih ljubimaca. Slike idu u prezentaciju. Učenje strpljenja — fokusiranje, kadar, čekanje pravog momenta. Vežba za pažnju koja se prenosi i na druge aktivnosti. Putovanja i izleti — dete pravi vlastiti dnevnik puta kroz slike. Posle se lakše seća detalja. Poklon za rođendan ili praznik — pakovanje izgleda lepo, dolazi u kutiji, ne treba dodatno umotavati. Specifikacije Uzrast 3–8 godina Funkcije Slika + video Memorija SD kartica (nije uključena) Baterija Punjiva Li-ion Punjenje USB kabl (u kompletu) Boja roze Tema astronaut Garancija 12 meseci Sadržaj kutije 1× dečji fotoaparat 1× USB kabl za punjenje 1× kratko uputstvo Kome ovaj fotoaparat nije za Pošteno — ovo nije zamena za pravi fotoaparat. Slika ima rezoluciju za printanje na razglednici, ne za štampanje u A3. Ekran je mali i nije touch. Za tinejdžera koji već koristi telefon — ovo neće biti zanimljivo nakon nedelju dana. Pogodno je za uzrast 3–8 godina. Pogledajte i ostale igračke za decu ili poklone u kući u našoj ponudi. { ""@context"": ""https://schema.org"", ""@type"": ""BreadcrumbList"", ""itemListElement"": [ { ""@type"": ""ListItem"", ""position"": 1, ""name"": ""Početna"", ""item"": ""https://www.poklonizadecu.com/"" }, { ""@type"": ""ListItem"", ""position"": 2, ""name"": ""Fotoaparat za decu"", ""item"": ""https://www.poklonizadecu.com/collections/fotoaparat-za-decu/"" }, { ""@type"": ""ListItem"", ""position"": 3, ""name"": ""Roze dečiji fotoaparat ""Astronaut“ — Digitalna kamera za decu"", ""item"": ""https://www.poklonizadecu.com/products/roze-deciji-fotoaparat-astronaut-digitalna-kamera-za-decu/"" } ] }","https://www.poklonizadecu.com/products/roze-deciji-fotoaparat-astronaut-digitalna-kamera-za-decu","https://cdn.shopify.com/s/files/1/0622/6382/0471/files/roze-deciji-fotoaparat-astronaut-digitalna-kamera-za-decu-1.jpg?v=1781084474","https://cdn.shopify.com/s/files/1/0622/6382/0471/files/roze-deciji-fotoaparat-astronaut-digitalna-kamera-za-decu-2.jpg?v=1781084474,https://cdn.shopify.com/s/files/1/0622/6382/0471/files/roze-deciji-fotoaparat-astronaut-digitalna-kamera-za-decu-3.jpg?v=1781084474,https://cdn.shopify.com/s/files/1/0622/6382/0471/files/roze-deciji-fotoaparat-astronaut-digitalna-kamera-za-decu-4.jpg?v=1781084474","in stock","new","4390.00 RSD","","PokloniZaDecu","","no","PKL-roze-deciji-fotoaparat-astronaut-digitalna-kamera-","1253","Igračke","RS::Standard:450 RSD","","","","","","","","","","","",""
"7436969967799","Šator zamak za princeze","ŠATOR ZA MALE PRINCEZE SA PUNO ENERGIJE - Dete će satima biti zaokupljeno igrom - - Ne može da dosadi - - Ima mesta da se i odrasli priključe - KONAČNO IGRAČKA OD KOJE SE DETE NEĆE ODVAJATI 1. Mogu da se igraju zajedno sa drugom decom 2. Da prave čajanke ili druge maštovite igre 3. Mogu čak i da spavaju u svom dvorcu KAD IM POKLONITE OVAKO NEŠTO DECA NE MOGU DA OBUZDAJU RADOST-PROVERENO OBEZBEDITE MALIŠANIMA NJIHOV KUTAK ZA IGRU 1. Napravljena od čvrstog platna 2. Prelepa roze boja 3. Velikih dimenzija 140x135cm 4. Torba za nošenje 100% SIGURNA KUPOVINA 30 dana povraćaj - lako i brzo! Bex pošiljka. (1-2 dana) Cena dostave je 390 dinara. PORUČI ŠATOR ZA PRINCEZE DOK JE JOŠ NA AKCIJI! (trenutno je 6 komada ostalo na stanju)","https://www.poklonizadecu.com/products/sator-zamak-za-princeze-poklon-lampice","https://cdn.shopify.com/s/files/1/0622/6382/0471/products/6.png?v=1701424434","https://cdn.shopify.com/s/files/1/0622/6382/0471/products/4.png?v=1701424434,https://cdn.shopify.com/s/files/1/0622/6382/0471/products/1_680e2dc0-13b9-46fe-86cc-528e6599e6d8.png?v=1701424434,https://cdn.shopify.com/s/files/1/0622/6382/0471/products/10.png?v=1701424434","in stock","new","4500.00 RSD","2490.00 RSD","Kupilica","","no","0030","632","","RS::Standard:450 RSD","","","","","","","","","","","",""
